image,caption,rating
http://134.100.15.200/flickr8k/Images/3503623999_bbd5dcfb18.jpg,"A woman in a red coat is smiling , while people in the background are walking around in winter clothing .",2.4623327
http://134.100.15.200/flickr8k/Images/3503623999_bbd5dcfb18.jpg,a woman wearing a black and white outfit while holding her sunglasses .,1.1943734
http://134.100.15.200/flickr8k/Images/3503689049_63212220be.jpg,A man wearing a black shirt and baseball cap smiling .,1.7765775
http://134.100.15.200/flickr8k/Images/3503689049_63212220be.jpg,A woman wears sunglasses and a black coat as she walks .,1.2012846
http://134.100.15.200/flickr8k/Images/3503689049_63212220be.jpg,A girl wearing a yellow shirt and sunglasses smiles .,1.5189896
http://134.100.15.200/flickr8k/Images/3503689049_63212220be.jpg,A man with a red collar and gray beard looks at the camera .,3.1986423
http://134.100.15.200/flickr8k/Images/350443876_c9769f5734.jpg,A small boy is building with some wooden blocks .,2.363697
http://134.100.15.200/flickr8k/Images/350443876_c9769f5734.jpg,A man balances on his forearms while a child watches in front of a colorful background .,2.0847955
http://134.100.15.200/flickr8k/Images/3504881781_6a842e043b.jpg,A crowd of people at an outdoor event,2.4516256
http://134.100.15.200/flickr8k/Images/3504881781_6a842e043b.jpg,A football player is talking to his coach .,1.5521847
http://134.100.15.200/flickr8k/Images/3504881781_6a842e043b.jpg,two men sit on a chairlift .,2.3307521
http://134.100.15.200/flickr8k/Images/3504881781_6a842e043b.jpg,a young man wearing dark sunglasses smiling,1.1413263
http://134.100.15.200/flickr8k/Images/3504881781_6a842e043b.jpg,Man in denim hat wearing dark sunglasses .,1.1605754
http://134.100.15.200/flickr8k/Images/3506468593_7e41a6d9f1.jpg,A white dog jumps to catch a blue ball in a living room .,1.1174357
http://134.100.15.200/flickr8k/Images/3506468593_7e41a6d9f1.jpg,A grey dog walks on top of a fallen tree in the woods .,1.1806657
http://134.100.15.200/flickr8k/Images/3506468593_7e41a6d9f1.jpg,two conoes float down the river .,1.421169
http://134.100.15.200/flickr8k/Images/3506468593_7e41a6d9f1.jpg,A man scales a rock in the forest .,3.328243
http://134.100.15.200/flickr8k/Images/3506468593_7e41a6d9f1.jpg,A man standing on a rock in a river with a spash next to him .,1.8929229
http://134.100.15.200/flickr8k/Images/3506560025_8d0f4f9ac4.jpg,A girl wearing a yellow shirt and sunglasses smiles .,1.2763677
http://134.100.15.200/flickr8k/Images/3506560025_8d0f4f9ac4.jpg,Little kids stand together and raise their hands in the air .,1.1357248
http://134.100.15.200/flickr8k/Images/3506560025_8d0f4f9ac4.jpg,The young adults take a group shot of themselves .,1.5906825
http://134.100.15.200/flickr8k/Images/3506560025_8d0f4f9ac4.jpg,a middle aged woman climbs a mountain .,1.3414955
http://134.100.15.200/flickr8k/Images/3507076266_8b17993fbb.jpg,Three people and a sled .,1.3681008
http://134.100.15.200/flickr8k/Images/3507076266_8b17993fbb.jpg,Men playing soccer in a field,1.901265
http://134.100.15.200/flickr8k/Images/3507076266_8b17993fbb.jpg,A man wearing glasses and his black and white dog wearing a black collar are playing with a tennis ball .,1.3701892
http://134.100.15.200/flickr8k/Images/3507076266_8b17993fbb.jpg,A man in a uniform playing with a black dog .,2.6521733
http://134.100.15.200/flickr8k/Images/3507076266_8b17993fbb.jpg,Man in brown jacket leading black horse,4.0358295
http://134.100.15.200/flickr8k/Images/3514019869_7de4ece2a5.jpg,A black and white dog prepares to catch a Frisbee .,2.7364397
http://134.100.15.200/flickr8k/Images/3514019869_7de4ece2a5.jpg,A woman next to a dog which is running an obstacle course .,2.9736123
http://134.100.15.200/flickr8k/Images/3514019869_7de4ece2a5.jpg,A dog jumps over an obstacle .,3.9285567
http://134.100.15.200/flickr8k/Images/3514019869_7de4ece2a5.jpg,A white dog is standing on its hind legs with a ball in its mouth .,1.9215643
http://134.100.15.200/flickr8k/Images/3514179514_cbc3371b92.jpg,A girl playing softball takes a strike .,2.4905972
http://134.100.15.200/flickr8k/Images/3514179514_cbc3371b92.jpg,A baseman tries to catch a ball while a runner tries to make the base in a community game .,3.998683
http://134.100.15.200/flickr8k/Images/3514179514_cbc3371b92.jpg,The cricketer is swinging a bat in the air .,3.1314487
http://134.100.15.200/flickr8k/Images/3516825206_5750824874.jpg,A man jumps while snow skiing .,1.2030523
http://134.100.15.200/flickr8k/Images/3516825206_5750824874.jpg,A person riding a horse with a mountain range in the far background .,1.210239
http://134.100.15.200/flickr8k/Images/3516825206_5750824874.jpg,A child running with a snowboard on a snow covered surface .,1.2890909
http://134.100.15.200/flickr8k/Images/3518126579_e70e0cbb2b.jpg,Group of children in blue uniforms sitting on steps .,1.7847183
http://134.100.15.200/flickr8k/Images/3518126579_e70e0cbb2b.jpg,A skateboarder jumps his board down a flight of stairs .,4.0403795
http://134.100.15.200/flickr8k/Images/3518126579_e70e0cbb2b.jpg,A young man attempts to ride a unicycle down an outdoor stairway stained with moss .,3.9548182
http://134.100.15.200/flickr8k/Images/3518126579_e70e0cbb2b.jpg,A man sits on the stairs next to his bike .,2.9952836
http://134.100.15.200/flickr8k/Images/3518126579_e70e0cbb2b.jpg,Two figures are walking by a pond .,1.7485632
http://134.100.15.200/flickr8k/Images/3521374954_37371b49a4.jpg,A little girl wearing sunglasses puts her feet into the kitchen sink .,1.5374365
http://134.100.15.200/flickr8k/Images/3521374954_37371b49a4.jpg,"A baby with a pink outfit on has a pacifier , and she is on a chair with another woman .",3.6497166
http://134.100.15.200/flickr8k/Images/3521374954_37371b49a4.jpg,A young girl is wearing a purple shirt and pink headband .,2.6814427
http://134.100.15.200/flickr8k/Images/3521374954_37371b49a4.jpg,A woman holds a fat baby with sunglasses and a denim hat .,3.1158514
http://134.100.15.200/flickr8k/Images/3523471597_87e0bf3b21.jpg,A man wearing a red hat looks down as another man watches .,1.7904449
http://134.100.15.200/flickr8k/Images/3523471597_87e0bf3b21.jpg,A group of five adults stand posing in front of buildings .,1.4880664
http://134.100.15.200/flickr8k/Images/3523471597_87e0bf3b21.jpg,A man with a red collar and gray beard looks at the camera .,1.4099803
http://134.100.15.200/flickr8k/Images/3523474077_16e14bc54c.jpg,"An adult with two kids , one child making a face and the other kissing the adult 's cheek .",1.5237749
http://134.100.15.200/flickr8k/Images/3523474077_16e14bc54c.jpg,A man in a suit dances with a young girl in front of an audience .,1.4941272
http://134.100.15.200/flickr8k/Images/3523559027_a65619a34b.jpg,Five people standing in front of a body of water .,1.3373929
http://134.100.15.200/flickr8k/Images/352382023_7605223d1c.jpg,Rafting boat on river .,2.0434208
http://134.100.15.200/flickr8k/Images/3523874798_9ba2fa46e3.jpg,A toddler in a red jacket is balancing on top of snow .,1.6656966
http://134.100.15.200/flickr8k/Images/3523874798_9ba2fa46e3.jpg,A young girl standing in front of a fountain,1.9823147
http://134.100.15.200/flickr8k/Images/3523874798_9ba2fa46e3.jpg,a white woman in a green sweater holds a smiling child whilst a smiling boy in a yellow shirt looks on .,1.1692035
http://134.100.15.200/flickr8k/Images/3523874798_9ba2fa46e3.jpg,Naked people riding bikes .,1.1239321
http://134.100.15.200/flickr8k/Images/3523874798_9ba2fa46e3.jpg,A man rides a yellow bike over a ramp while others watch .,1.2765043
http://134.100.15.200/flickr8k/Images/3523874798_9ba2fa46e3.jpg,The two children swinging together on a swing .,1.1822162
http://134.100.15.200/flickr8k/Images/3523874798_9ba2fa46e3.jpg,A person on a skateboard .,4.085997
http://134.100.15.200/flickr8k/Images/352981175_16ff5c07e4.jpg,A man riding a blue motorcycle jumps over a ramp .,1.128951
http://134.100.15.200/flickr8k/Images/352981175_16ff5c07e4.jpg,Two people on a motorcycle .,1.1663435
http://134.100.15.200/flickr8k/Images/352981175_16ff5c07e4.jpg,A child sleds over a mound of snow as others watch him .,2.049857
http://134.100.15.200/flickr8k/Images/352981175_16ff5c07e4.jpg,Two children kneeling down with pirate hats on,1.2305585
http://134.100.15.200/flickr8k/Images/3530843182_35af2c821c.jpg,a white woman in a green sweater holds a smiling child whilst a smiling boy in a yellow shirt looks on .,1.673914
http://134.100.15.200/flickr8k/Images/3530843182_35af2c821c.jpg,The young adults take a group shot of themselves .,3.2616274
http://134.100.15.200/flickr8k/Images/3530843182_35af2c821c.jpg,A boy sitting in a car making a surprised face,2.0612252
http://134.100.15.200/flickr8k/Images/353180303_6a24179c50.jpg,An old man with white hair in a red hat,1.1870948
http://134.100.15.200/flickr8k/Images/353180303_6a24179c50.jpg,A woman sings into a microphone while playing guitar .,1.8233626
http://134.100.15.200/flickr8k/Images/353180303_6a24179c50.jpg,A woman wearing a hat and red scarf stands among others wearing similar clothes .,2.91819
http://134.100.15.200/flickr8k/Images/3532205154_5674b628ea.jpg,"An asian man in a suit on the subway , asleep .",1.204893
http://134.100.15.200/flickr8k/Images/3532205154_5674b628ea.jpg,A profile of a young person with a punk hairstyle and pierced ear and nose in a cowboy shirt .,3.4463785
http://134.100.15.200/flickr8k/Images/3532205154_5674b628ea.jpg,A man is sitting at a table full of military items and clothing .,1.4591582
http://134.100.15.200/flickr8k/Images/3537400880_8f410d747d.jpg,Naked people riding bikes .,1.1517367
http://134.100.15.200/flickr8k/Images/3537400880_8f410d747d.jpg,A person on a dirt bike is riding up a sandy hill .,2.2379313
http://134.100.15.200/flickr8k/Images/3537400880_8f410d747d.jpg,A brown dog leaps into the air next to a black dog on a sandy bay .,1.1418273
http://134.100.15.200/flickr8k/Images/3537400880_8f410d747d.jpg,A person drives an ATV through mud .,1.1316484
http://134.100.15.200/flickr8k/Images/3538213870_9856a76b2a.jpg,The girls were in the crowd .,2.6006694
http://134.100.15.200/flickr8k/Images/3538213870_9856a76b2a.jpg,A young girl is wearing a purple shirt and pink headband .,3.350799
http://134.100.15.200/flickr8k/Images/3538213870_9856a76b2a.jpg,Girls in pink dresses walk toward a cruise ship,2.305554
http://134.100.15.200/flickr8k/Images/3539767254_c598b8e6c7.jpg,Five people standing in front of a body of water .,2.6201363
http://134.100.15.200/flickr8k/Images/3539767254_c598b8e6c7.jpg,A black dog jumps into the water off a dock .,1.2120748
http://134.100.15.200/flickr8k/Images/3539767254_c598b8e6c7.jpg,A man and woman look back at the camera while standing in front of a red art structure .,1.1258076
http://134.100.15.200/flickr8k/Images/3539767254_c598b8e6c7.jpg,Two boys jumping off the pier into the water .,1.4199448
http://134.100.15.200/flickr8k/Images/3540416981_4e74f08cbb.jpg,Two white dogs running,2.9672966
http://134.100.15.200/flickr8k/Images/3540416981_4e74f08cbb.jpg,Five black dogs running across the grass .,1.5237439
http://134.100.15.200/flickr8k/Images/3540416981_4e74f08cbb.jpg,A white dog jumps in the water to catch a tennis ball .,3.235343
http://134.100.15.200/flickr8k/Images/3540416981_4e74f08cbb.jpg,"A white dog runs in the grass ,",3.637142
http://134.100.15.200/flickr8k/Images/3540416981_4e74f08cbb.jpg,A white dog with a muzzle is running through an uncut field with a fence nearby .,3.2803895
http://134.100.15.200/flickr8k/Images/3541474181_489f19fae7.jpg,A man jumps while snow skiing .,3.6158962
http://134.100.15.200/flickr8k/Images/3541474181_489f19fae7.jpg,Person snowboarding at a ski slope .,4.2225666
http://134.100.15.200/flickr8k/Images/3541474181_489f19fae7.jpg,a skier is throwing up snow as he skis off piste .,3.5025969
http://134.100.15.200/flickr8k/Images/3542484764_77d8920ec9.jpg,rugby match,1.3274584
http://134.100.15.200/flickr8k/Images/3542484764_77d8920ec9.jpg,A baseman tries to catch a ball while a runner tries to make the base in a community game .,1.1326263
http://134.100.15.200/flickr8k/Images/3542484764_77d8920ec9.jpg,Collie jumping over a training hurdle that is on the grass .,1.2896862
http://134.100.15.200/flickr8k/Images/3544793763_b38546a5e8.jpg,rugby match,3.5173032
http://134.100.15.200/flickr8k/Images/3544793763_b38546a5e8.jpg,A man wearing black boxing shorts and white boxing gloves and a man in white boxing shorts and white boxing gloves are fighting in the ring .,4.6149707
http://134.100.15.200/flickr8k/Images/3544793763_b38546a5e8.jpg,Two boxers with white gloves are fighting .,4.4685135
http://134.100.15.200/flickr8k/Images/3544793763_b38546a5e8.jpg,A man balances on his forearms while a child watches in front of a colorful background .,1.5507023
http://134.100.15.200/flickr8k/Images/3545586120_283d728a97.jpg,Two people are sitting next to a wood-stacked campfire at night .,1.1583638
http://134.100.15.200/flickr8k/Images/3545586120_283d728a97.jpg,A martial artist breaks a brick .,1.4650853
http://134.100.15.200/flickr8k/Images/3545586120_283d728a97.jpg,A man wearing black boxing shorts and white boxing gloves and a man in white boxing shorts and white boxing gloves are fighting in the ring .,4.3269634
http://134.100.15.200/flickr8k/Images/3545652636_0746537307.jpg,A young boy is getting ready to hit a baseball .,1.9992548
http://134.100.15.200/flickr8k/Images/3545652636_0746537307.jpg,A little boy preparing to hit a baseball,2.0899274
http://134.100.15.200/flickr8k/Images/3545652636_0746537307.jpg,Two women are playing a game with sticks and a small white ball .,1.1706681
http://134.100.15.200/flickr8k/Images/3545652636_0746537307.jpg,A man in a red uniform is playing backset ball with a man in a white uniform blocking his shot .,2.5994878
http://134.100.15.200/flickr8k/Images/3545652636_0746537307.jpg,Two women with blue and white uniforms playing floor hockey,2.093897
http://134.100.15.200/flickr8k/Images/3545652636_0746537307.jpg,A soccer team wearing red posing together .,2.8060818
http://134.100.15.200/flickr8k/Images/354642192_3b7666a2dd.jpg,a boy jumps into the blue pool water .,3.3519797
http://134.100.15.200/flickr8k/Images/354642192_3b7666a2dd.jpg,a dog is making a splash in a blue paddling pool .,3.0672703
http://134.100.15.200/flickr8k/Images/354642192_3b7666a2dd.jpg,A boys jumps in the water while another boy looks on .,1.2536123
http://134.100.15.200/flickr8k/Images/354642192_3b7666a2dd.jpg,The boy is whispering in the girls ear .,1.123118
http://134.100.15.200/flickr8k/Images/3549583146_3e8bb2f7e9.jpg,A young child is riding a purple bike .,3.3534935
http://134.100.15.200/flickr8k/Images/3549583146_3e8bb2f7e9.jpg,"A smiling boy in an orange shirt with a safari hat sits at the playground , while a boy in a blue shirt looks on .",2.6951046
http://134.100.15.200/flickr8k/Images/3549583146_3e8bb2f7e9.jpg,A little boy with a blue helmet rides his bike with his feet on the handlebars .,3.6214101
http://134.100.15.200/flickr8k/Images/3549583146_3e8bb2f7e9.jpg,A young boy is riding a bike .,4.156398
http://134.100.15.200/flickr8k/Images/3554634863_5f6f616639.jpg,A crowd of people at an outdoor event,3.6341043
http://134.100.15.200/flickr8k/Images/3554634863_5f6f616639.jpg,A woman wearing a white glove peers over the crowd .,1.1983547
http://134.100.15.200/flickr8k/Images/3554634863_5f6f616639.jpg,A crowd of people stands attentively in a plaza with buildings in the background .,1.8597277
http://134.100.15.200/flickr8k/Images/3554634863_5f6f616639.jpg,A group of men are playing rugby .,1.1598204
http://134.100.15.200/flickr8k/Images/3554634863_5f6f616639.jpg,A woman writing while standing by men .,1.8120705
http://134.100.15.200/flickr8k/Images/3554634863_5f6f616639.jpg,"Crowded Mexican restaurant , empty chair in foreground .",2.0166118
http://134.100.15.200/flickr8k/Images/3554634863_5f6f616639.jpg,"Talk between man in Hawaiian shirt , older man in gray and man seen from behind .",3.2161837
http://134.100.15.200/flickr8k/Images/3556598205_86c180769d.jpg,A person on a dirt bike is riding up a sandy hill .,3.8569448
http://134.100.15.200/flickr8k/Images/3556598205_86c180769d.jpg,A man riding a motorbike kicks up dirt .,4.0173087
http://134.100.15.200/flickr8k/Images/3556598205_86c180769d.jpg,A person is in the air while riding his bicycle on top of the train on a clear blue sky day .,1.300068
http://134.100.15.200/flickr8k/Images/3558370311_5734a15890.jpg,A man wearing all black and a black hat is smiling .,2.8679266
http://134.100.15.200/flickr8k/Images/3558370311_5734a15890.jpg,"A man with dark glasses , a black jacket , and a white and red horizontally-striped shirt pointing at something while standing on a sidewalk .",1.5511861
http://134.100.15.200/flickr8k/Images/3562050678_4196a7fff3.jpg,A black dog walks on the beach near the rocks .,2.307571
http://134.100.15.200/flickr8k/Images/3562050678_4196a7fff3.jpg,A person is standing on jagged rocks above the water below .,2.6831172
http://134.100.15.200/flickr8k/Images/3562050678_4196a7fff3.jpg,A man standing on a rock in a river with a spash next to him .,1.4007285
http://134.100.15.200/flickr8k/Images/3564312955_716e86c48b.jpg,A young boy in a swimming suit sits in water .,2.9106214
http://134.100.15.200/flickr8k/Images/3564312955_716e86c48b.jpg,A boy in swim trunks screams while being sprayed with water .,3.192391
http://134.100.15.200/flickr8k/Images/3564312955_716e86c48b.jpg,A small child squats and puts dirt into his mouth .,2.2614634
http://134.100.15.200/flickr8k/Images/3564312955_716e86c48b.jpg,Two girls with orange shirts .,2.6150422
http://134.100.15.200/flickr8k/Images/3564543247_05cdbc31cf.jpg,a boy jumps into the blue pool water .,3.608834
http://134.100.15.200/flickr8k/Images/3564543247_05cdbc31cf.jpg,Naked people riding bikes .,1.3496163
http://134.100.15.200/flickr8k/Images/3564543247_05cdbc31cf.jpg,A little boy is jumping out of the pool .,3.5467703
http://134.100.15.200/flickr8k/Images/3564543247_05cdbc31cf.jpg,a boy plays with a noodle by the pool .,1.9650346
http://134.100.15.200/flickr8k/Images/3564543247_05cdbc31cf.jpg,A boy takes a flying leap into the water .,3.8064697
http://134.100.15.200/flickr8k/Images/3564543247_05cdbc31cf.jpg,Children play in an inflatable pool .,3.7419155
http://134.100.15.200/flickr8k/Images/3565598162_56044bc2f7.jpg,People waiting to cross the street in front of a pharmacy with lit up sign .,2.2753828
http://134.100.15.200/flickr8k/Images/3565598162_56044bc2f7.jpg,almost 2 dozen people are riding on the outside of a cart down a road,2.4230227
http://134.100.15.200/flickr8k/Images/3565598162_56044bc2f7.jpg,A group of five adults stand posing in front of buildings .,3.1754622
http://134.100.15.200/flickr8k/Images/3565598162_56044bc2f7.jpg,A woman writing while standing by men .,2.9115038
http://134.100.15.200/flickr8k/Images/3565598162_56044bc2f7.jpg,A man wearing a green shirt looks down at a cellphone .,1.5787785
http://134.100.15.200/flickr8k/Images/3565598162_56044bc2f7.jpg,People stand outside near a concrete wall and a window .,3.126871
http://134.100.15.200/flickr8k/Images/3565598162_56044bc2f7.jpg,A person descends a rope from a cliff into the ocean .,1.1305151
http://134.100.15.200/flickr8k/Images/3568197730_a071d7595b.jpg,"Two guys walking , one carrying a skateboard",2.4684486
http://134.100.15.200/flickr8k/Images/3568197730_a071d7595b.jpg,A man carries a child while he walks with a woman .,2.5578215
http://134.100.15.200/flickr8k/Images/3568197730_a071d7595b.jpg,An in-line skater is attempting a trick in a long metal rail behind a large structure .,3.8488176
http://134.100.15.200/flickr8k/Images/3568197730_a071d7595b.jpg,A man on a bike is jumping off a dirt ramp .,2.5028715
http://134.100.15.200/flickr8k/Images/3569406219_f37ebf7b92.jpg,A skateboarder in striped shorts skating down a street .,1.2157215
http://134.100.15.200/flickr8k/Images/3569406219_f37ebf7b92.jpg,A woman sings into a microphone while playing guitar .,1.4935069
http://134.100.15.200/flickr8k/Images/3569406219_f37ebf7b92.jpg,A brown and white dogs stands in front of a wooden building while tennis balls fly through the air .,2.1125965
http://134.100.15.200/flickr8k/Images/3569406219_f37ebf7b92.jpg,A man standing in front of a brick building .,2.262927
http://134.100.15.200/flickr8k/Images/3569979711_6507841268.jpg,"A young , long-haired , girl on the beach , is jumping in the air .",3.8104217
http://134.100.15.200/flickr8k/Images/3569979711_6507841268.jpg,"A man in grey on a rocky cliff , overlooking the mountains .",1.4178661
http://134.100.15.200/flickr8k/Images/3571147934_d1c8af1d6e.jpg,Three people sit at an outdoor cafe .,1.4145551
http://134.100.15.200/flickr8k/Images/3571147934_d1c8af1d6e.jpg,Men burn an Israeli flag .,1.144781
http://134.100.15.200/flickr8k/Images/3571147934_d1c8af1d6e.jpg,Two women with a baby carriage in a building next to a table and chairs .,1.8572087
http://134.100.15.200/flickr8k/Images/3571147934_d1c8af1d6e.jpg,Two women are dancing while men play music behind them .,2.546167
http://134.100.15.200/flickr8k/Images/3571147934_d1c8af1d6e.jpg,Kids are waiting at the bottom of a staircase attached to a brick building .,3.773737
http://134.100.15.200/flickr8k/Images/3571147934_d1c8af1d6e.jpg,A man standing in front of a brick building .,2.6830294
http://134.100.15.200/flickr8k/Images/3572267708_9d8a81d4a4.jpg,An adult is pulling a child out of a ball pit .,1.4597795
http://134.100.15.200/flickr8k/Images/3572267708_9d8a81d4a4.jpg,people are at a costume party .,3.3095534
http://134.100.15.200/flickr8k/Images/3576259024_9c05b163aa.jpg,A little boy is leaping in the air onto a water slide .,1.507332
http://134.100.15.200/flickr8k/Images/3576259024_9c05b163aa.jpg,A man riding a brown horse poses in front of a mountain scene .,1.4628391
http://134.100.15.200/flickr8k/Images/3578841731_f775cab089.jpg,A little dog running on sand .,1.1842145
http://134.100.15.200/flickr8k/Images/3578914491_36019ba703.jpg,"A white dog runs in the grass ,",1.7856474
http://134.100.15.200/flickr8k/Images/3582742297_1daa29968e.jpg,Three dogs are running in a field .,3.7381053
http://134.100.15.200/flickr8k/Images/3582742297_1daa29968e.jpg,A dog is taking a dive into a body of water .,1.9846122
http://134.100.15.200/flickr8k/Images/3582742297_1daa29968e.jpg,Two dogs run down a dirt path in the forest .,3.251689
http://134.100.15.200/flickr8k/Images/3584534971_b44f82c4b9.jpg,A woman riding a bike in a park,3.0969229
http://134.100.15.200/flickr8k/Images/3584534971_b44f82c4b9.jpg,A little boy with a blue helmet rides his bike with his feet on the handlebars .,3.2446566
http://134.100.15.200/flickr8k/Images/3584534971_b44f82c4b9.jpg,girl posing on tree,1.1363722
http://134.100.15.200/flickr8k/Images/3584561689_b6eb24dd70.jpg,"A young , fit man wearing short does a high right kick in the air .",3.581
http://134.100.15.200/flickr8k/Images/3584561689_b6eb24dd70.jpg,A snowboarder jumps high in the air over a snowy hill .,1.1614553
http://134.100.15.200/flickr8k/Images/3584561689_b6eb24dd70.jpg,A young woman watches as a young blond boy swings in a chair swing with buildings visible in the background .,2.509698
http://134.100.15.200/flickr8k/Images/3584930205_a3f58a4b7c.jpg,A man and young girl eat a meal on a city street .,1.1335766
http://134.100.15.200/flickr8k/Images/3584930205_a3f58a4b7c.jpg,A little girl wearing a pink shirt jumps off a swing .,1.1507895
http://134.100.15.200/flickr8k/Images/3584930205_a3f58a4b7c.jpg,A skateboarder is performing a trick in the air .,3.9684477
http://134.100.15.200/flickr8k/Images/3584930205_a3f58a4b7c.jpg,A cyclist in a helmet and yellow jersey .,1.1926081
http://134.100.15.200/flickr8k/Images/3585487286_ef9a8d4c56.jpg,A black dog is coming out of the ocean water on the beach with something in its mouth .,2.9697123
http://134.100.15.200/flickr8k/Images/3585487286_ef9a8d4c56.jpg,A white dog is running through the water onto the shore .,4.0730715
http://134.100.15.200/flickr8k/Images/3585487286_ef9a8d4c56.jpg,A dog is running along the beach beside the ocean .,3.9600463
http://134.100.15.200/flickr8k/Images/3585598356_8ce815bbb9.jpg,Two woman in colorful costumes look at a little girl wearing a brown vest .,3.3450594
http://134.100.15.200/flickr8k/Images/3585598356_8ce815bbb9.jpg,Two men and a woman smile at the camera .,1.6633205
http://134.100.15.200/flickr8k/Images/3585598356_8ce815bbb9.jpg,A woman posing with a statue alongside a group of boys,1.96957
http://134.100.15.200/flickr8k/Images/3585598356_8ce815bbb9.jpg,two woman are showing different facial expressions and wearing gold and purple costumes .,4.3528376
http://134.100.15.200/flickr8k/Images/3585598356_8ce815bbb9.jpg,a woman wearing a black and white outfit while holding her sunglasses .,1.4323838
http://134.100.15.200/flickr8k/Images/3585598356_8ce815bbb9.jpg,A young girl dressed in pink with a hair barrette pursing her lips at a big chocolate milkshake .,2.0126877
http://134.100.15.200/flickr8k/Images/3589367895_5d3729e3ea.jpg,A group of students in uniform stand in front of the gate .,1.2654223
http://134.100.15.200/flickr8k/Images/3589367895_5d3729e3ea.jpg,A musician and a crowd next to stage full of musical instruments .,2.0872712
http://134.100.15.200/flickr8k/Images/3589367895_5d3729e3ea.jpg,An Indian chief in full dress .,3.7488725
http://134.100.15.200/flickr8k/Images/3589895574_ee08207d26.jpg,A little girl sits in a plastic swing set .,3.630601
http://134.100.15.200/flickr8k/Images/3589895574_ee08207d26.jpg,A little boy is going down a pulley swing .,3.9275832
http://134.100.15.200/flickr8k/Images/3589895574_ee08207d26.jpg,A girls in a blue shirt holds a flower while sitting on a man 's shoulders .,2.5099707
http://134.100.15.200/flickr8k/Images/3589895574_ee08207d26.jpg,Two children swinging on a tire swing .,3.4907625
