Image,Caption
http://134.100.15.200/flickr8k/Images/2473738924_eca928d12f.jpg,Two little girls practice martial arts .
http://134.100.15.200/flickr8k/Images/2473738924_eca928d12f.jpg,A young boy is practicing his karate in a gym .
http://134.100.15.200/flickr8k/Images/2473738924_eca928d12f.jpg,Two boxers with white gloves are fighting .
http://134.100.15.200/flickr8k/Images/2473791980_805c819bd4.jpg,Two dogs moving through water close to the shore .
http://134.100.15.200/flickr8k/Images/2473791980_805c819bd4.jpg,A man is sky surfing on the water .
http://134.100.15.200/flickr8k/Images/2473791980_805c819bd4.jpg,A man wakeboards on choppy water .
http://134.100.15.200/flickr8k/Images/2473791980_805c819bd4.jpg,A young girl stands under three large rings that shoot water in a water park .
http://134.100.15.200/flickr8k/Images/2475162978_2c51048dca.jpg,Large dog plays with two smaller dogs on grass .
http://134.100.15.200/flickr8k/Images/2475162978_2c51048dca.jpg,"A dog runs through a lush , green lawn ."
http://134.100.15.200/flickr8k/Images/2475162978_2c51048dca.jpg,A small child sucks his thumb while sleeping with a pink blanket on a multi-colored seat .
http://134.100.15.200/flickr8k/Images/2475162978_2c51048dca.jpg,Two dogs wearing shirts play in the green grass .
http://134.100.15.200/flickr8k/Images/247637795_fdf26a03cf.jpg,A woman is taking a swing with a golf club .
http://134.100.15.200/flickr8k/Images/247637795_fdf26a03cf.jpg,A small black and white dog jumps at a woman in a white jeep while a golden dog follows beside them .
http://134.100.15.200/flickr8k/Images/247637795_fdf26a03cf.jpg,A dog is taking a dive into a body of water .
http://134.100.15.200/flickr8k/Images/247637795_fdf26a03cf.jpg,A black man playing basketball with orange shoes
http://134.100.15.200/flickr8k/Images/247637795_fdf26a03cf.jpg,Person in gray jacket and blue pants balancing board on handrail
http://134.100.15.200/flickr8k/Images/247637795_fdf26a03cf.jpg,a group of people sitting outside in the dirt on the ground .
http://134.100.15.200/flickr8k/Images/247704641_d883902277.jpg,Two dogs moving through water close to the shore .
http://134.100.15.200/flickr8k/Images/247704641_d883902277.jpg,The large brown dog is chasing after the little brown dog .
http://134.100.15.200/flickr8k/Images/247704641_d883902277.jpg,Boat number 5 has several men with life jackets paddling the water .
http://134.100.15.200/flickr8k/Images/247704641_d883902277.jpg,A person is riding in a canoe on a lake next to green trees .
http://134.100.15.200/flickr8k/Images/247704641_d883902277.jpg,A man is diving into water near a shore .
http://134.100.15.200/flickr8k/Images/2479162876_a5ce3306af.jpg,A brown dog shaking off water .
http://134.100.15.200/flickr8k/Images/2479162876_a5ce3306af.jpg,A shaggy dog runs down a dirt trail in a lush forest .
http://134.100.15.200/flickr8k/Images/2479162876_a5ce3306af.jpg,Two dogs run across the barren ground .
http://134.100.15.200/flickr8k/Images/2479162876_a5ce3306af.jpg,Two dogs run down a dirt path in the forest .
http://134.100.15.200/flickr8k/Images/2479652566_8f9fac8af5.jpg,A small child sucks his thumb while sleeping with a pink blanket on a multi-colored seat .
http://134.100.15.200/flickr8k/Images/2480327661_fb69829f57.jpg,Two little girls dance on a hardwood floor in the house .
http://134.100.15.200/flickr8k/Images/2480850054_de3433b54a.jpg,Two dogs in motion in a grassy field with small trees .
http://134.100.15.200/flickr8k/Images/2480850054_de3433b54a.jpg,Brown and white dog runs through brush .
http://134.100.15.200/flickr8k/Images/2480850054_de3433b54a.jpg,A brown and white dogs stands in front of a wooden building while tennis balls fly through the air .
http://134.100.15.200/flickr8k/Images/2482629385_f370b290d1.jpg,A small dogs ears stick up as it runs in the grass .
http://134.100.15.200/flickr8k/Images/2482629385_f370b290d1.jpg,A brown dog sitting on grass
http://134.100.15.200/flickr8k/Images/2482629385_f370b290d1.jpg,A small brown and white dog running through tall grass .
http://134.100.15.200/flickr8k/Images/2482629385_f370b290d1.jpg,A muzzled animal jumps over a metal bar and splashes through the mud .
http://134.100.15.200/flickr8k/Images/2482629385_f370b290d1.jpg,A small boy with braids runs through a field of tall green grass .
http://134.100.15.200/flickr8k/Images/2484190118_e89363c465.jpg,Two girls and a woman walking on the sidewalk
http://134.100.15.200/flickr8k/Images/2484190118_e89363c465.jpg,a kid standing in the middle of a dirt road
http://134.100.15.200/flickr8k/Images/2490768374_45d94fc658.jpg,a girl peeks through the green leaves .
http://134.100.15.200/flickr8k/Images/2490768374_45d94fc658.jpg,People at park sitting on benches and a woman taking care of her child in the stroller .
http://134.100.15.200/flickr8k/Images/2490768374_45d94fc658.jpg,Children play in an inflatable pool .
http://134.100.15.200/flickr8k/Images/2490768374_45d94fc658.jpg,Child sitting at a backyard picnic table .
http://134.100.15.200/flickr8k/Images/249394748_2e4acfbbb5.jpg,Two children playing with a ball on the grass .
http://134.100.15.200/flickr8k/Images/249394748_2e4acfbbb5.jpg,Three dogs are running in a field .
http://134.100.15.200/flickr8k/Images/249394748_2e4acfbbb5.jpg,A dog fetches a ball in a field .
http://134.100.15.200/flickr8k/Images/249394748_2e4acfbbb5.jpg,"Three black dogs , two with tan markings , are running along grass ."
http://134.100.15.200/flickr8k/Images/249394748_2e4acfbbb5.jpg,A dog running toward the camera in a field .
http://134.100.15.200/flickr8k/Images/249394748_2e4acfbbb5.jpg,Two dogs are playing together outside .
http://134.100.15.200/flickr8k/Images/2495931537_9b8d4474b6.jpg,A white dog jumps to catch a blue ball in a living room .
http://134.100.15.200/flickr8k/Images/2495931537_9b8d4474b6.jpg,Close-up of dog in profile with mouth open .
http://134.100.15.200/flickr8k/Images/2496370758_a3fbc49837.jpg,A small dogs ears stick up as it runs in the grass .
http://134.100.15.200/flickr8k/Images/2496370758_a3fbc49837.jpg,Small black and white dog wearing a red harness is running around with a ball in its mouth .
http://134.100.15.200/flickr8k/Images/2496370758_a3fbc49837.jpg,A dog chasing a deer in a field of yellow flowers .
http://134.100.15.200/flickr8k/Images/2496370758_a3fbc49837.jpg,Two dogs run through a field .
http://134.100.15.200/flickr8k/Images/2497420371_74788d7ba1.jpg,Two girls are sitting on a path by a river with their bicycles parked beside them .
http://134.100.15.200/flickr8k/Images/2497420371_74788d7ba1.jpg,People are gathered around watching children with a pig .
http://134.100.15.200/flickr8k/Images/2497420371_74788d7ba1.jpg,A group of people are sitting on the porch of a brick building .
http://134.100.15.200/flickr8k/Images/2497420371_74788d7ba1.jpg,People are enjoying drinks at a table outside a large brick building .
http://134.100.15.200/flickr8k/Images/2497420371_74788d7ba1.jpg,Kids are waiting at the bottom of a staircase attached to a brick building .
http://134.100.15.200/flickr8k/Images/2498897831_0bbb5d5b51.jpg,People at park sitting on benches and a woman taking care of her child in the stroller .
http://134.100.15.200/flickr8k/Images/2498897831_0bbb5d5b51.jpg,A young girl is wearing a purple shirt and pink headband .
http://134.100.15.200/flickr8k/Images/2501595799_6316001e89.jpg,"A young , long-haired , girl on the beach , is jumping in the air ."
http://134.100.15.200/flickr8k/Images/2501595799_6316001e89.jpg,A little boy is jumping out of the pool .
http://134.100.15.200/flickr8k/Images/2501595799_6316001e89.jpg,A swimmer is doing the backstroke in the swimming pool .
http://134.100.15.200/flickr8k/Images/2501595799_6316001e89.jpg,Three Orca whales jump in a pool at seaworld .
http://134.100.15.200/flickr8k/Images/2502905671_c6039804ab.jpg,Two people walking along the beach at sunset towarn a group of people .
http://134.100.15.200/flickr8k/Images/2502905671_c6039804ab.jpg,A person walks along the beach and leaves footprints in the sand .
http://134.100.15.200/flickr8k/Images/2502905671_c6039804ab.jpg,A man kneels in the wet sand at a beach near a dog .
http://134.100.15.200/flickr8k/Images/2502905671_c6039804ab.jpg,A black dog walks on the beach near the rocks .
http://134.100.15.200/flickr8k/Images/2502905671_c6039804ab.jpg,a dog on the beach .
http://134.100.15.200/flickr8k/Images/2505988632_9541f15583.jpg,"Two kids ride their bikes by the ocean , in the evening ."
http://134.100.15.200/flickr8k/Images/2505988632_9541f15583.jpg,A girl playing softball takes a strike .
http://134.100.15.200/flickr8k/Images/2510020918_b2ca0fb2aa.jpg,Two men and a woman smile at the camera .
http://134.100.15.200/flickr8k/Images/2510020918_b2ca0fb2aa.jpg,A little girl is sliding down a tunnel smiling .
http://134.100.15.200/flickr8k/Images/2511019188_ca71775f2d.jpg,Five black dogs running across the grass .
http://134.100.15.200/flickr8k/Images/2511019188_ca71775f2d.jpg,Two dogs wearing shirts play in the green grass .
http://134.100.15.200/flickr8k/Images/2518508760_68d8df7365.jpg,A greyhound wearing a muzzle and the number six on a yellow jacket is running on a dog track .
http://134.100.15.200/flickr8k/Images/2518508760_68d8df7365.jpg,Three dogs running on a racing track .
http://134.100.15.200/flickr8k/Images/2518508760_68d8df7365.jpg,Two greyhounds race .
http://134.100.15.200/flickr8k/Images/2518508760_68d8df7365.jpg,"A muzzled dog in a race , with four dogs following ."
http://134.100.15.200/flickr8k/Images/2521770311_3086ca90de.jpg,a boy plays with a noodle by the pool .
http://134.100.15.200/flickr8k/Images/2521770311_3086ca90de.jpg,"One child lifts another on his back , inside a room ."
http://134.100.15.200/flickr8k/Images/2521770311_3086ca90de.jpg,A woman is reading literature and sitting on the front stoop of a building .
http://134.100.15.200/flickr8k/Images/2522297487_57edf117f7.jpg,A couple is sitting in a restaurant holding hands .
http://134.100.15.200/flickr8k/Images/2522297487_57edf117f7.jpg,a young boy making a big mess on the floor and table while eating cereal
http://134.100.15.200/flickr8k/Images/2522297487_57edf117f7.jpg,The person in the yellow shirt is sitting with a child at a wooden picnic table .
http://134.100.15.200/flickr8k/Images/2522297487_57edf117f7.jpg,Four small children sit on tall stools at a restaurant bar .
http://134.100.15.200/flickr8k/Images/2522297487_57edf117f7.jpg,"The legs and feet of people sitting on a wooden table , two cameras and cigarettes on it ."
http://134.100.15.200/flickr8k/Images/2525270674_4ab536e7ec.jpg,A white dog jumps to catch a blue ball in a living room .
http://134.100.15.200/flickr8k/Images/2525270674_4ab536e7ec.jpg,A brown dog sitting on grass
http://134.100.15.200/flickr8k/Images/2525270674_4ab536e7ec.jpg,Two long-haired puppy dogs have a romp in the snow .
http://134.100.15.200/flickr8k/Images/2525270674_4ab536e7ec.jpg,"Two dogs , one brown and white and one black and white , run on a field ."
http://134.100.15.200/flickr8k/Images/2525270674_4ab536e7ec.jpg,Two dogs in motion in a grassy field with small trees .
http://134.100.15.200/flickr8k/Images/2525270674_4ab536e7ec.jpg,A white dog and brown dog fighting .
http://134.100.15.200/flickr8k/Images/2525270674_4ab536e7ec.jpg,Two dogs are playing together outside .
http://134.100.15.200/flickr8k/Images/2525270674_4ab536e7ec.jpg,"A white dog runs in the grass ,"
http://134.100.15.200/flickr8k/Images/2526041608_a9775ab8d7.jpg,Two girls in soccer strips are playing on a sports field .
http://134.100.15.200/flickr8k/Images/2526041608_a9775ab8d7.jpg,Two boys play with two dogs at the shore .
http://134.100.15.200/flickr8k/Images/2526041608_a9775ab8d7.jpg,Men playing soccer in a field
http://134.100.15.200/flickr8k/Images/2526041608_a9775ab8d7.jpg,a dog playing with a blue ball
http://134.100.15.200/flickr8k/Images/2526041608_a9775ab8d7.jpg,Little kids stand together and raise their hands in the air .
http://134.100.15.200/flickr8k/Images/2526041608_a9775ab8d7.jpg,Team members being lifted up high to catch a flying ball .
http://134.100.15.200/flickr8k/Images/2526585002_10987a63f3.jpg,People are in a ride that drops you from a great height .
http://134.100.15.200/flickr8k/Images/2526585002_10987a63f3.jpg,"A dog , lying down , tethered to the side mirror of a yellow VW bus ."
http://134.100.15.200/flickr8k/Images/2526585002_10987a63f3.jpg,The three men and three dogs floated in the yellow boat .
http://134.100.15.200/flickr8k/Images/2526585002_10987a63f3.jpg,A man rides a yellow bike over a ramp while others watch .
http://134.100.15.200/flickr8k/Images/2529116152_4331dabf50.jpg,A man is sky surfing on the water .
http://134.100.15.200/flickr8k/Images/2529116152_4331dabf50.jpg,A skateboarder midair with his skateboard .
http://134.100.15.200/flickr8k/Images/2529116152_4331dabf50.jpg,A person is in the air while riding his bicycle on top of the train on a clear blue sky day .
http://134.100.15.200/flickr8k/Images/2529116152_4331dabf50.jpg,A man on a bike is jumping off a dirt ramp .
http://134.100.15.200/flickr8k/Images/2533424347_cf2f84872b.jpg,A race car screeches through a turn as spectators watch .
http://134.100.15.200/flickr8k/Images/2533642917_a5eace85e6.jpg,A boy in a blue life jacket jumps into the water .
http://134.100.15.200/flickr8k/Images/2533642917_a5eace85e6.jpg,Boys in life jackets on a watercraft .
http://134.100.15.200/flickr8k/Images/2533642917_a5eace85e6.jpg,A boys jumps in the water while another boy looks on .
http://134.100.15.200/flickr8k/Images/2533642917_a5eace85e6.jpg,A child sleds over a mound of snow as others watch him .
http://134.100.15.200/flickr8k/Images/2533642917_a5eace85e6.jpg,A young woman watches as a young blond boy swings in a chair swing with buildings visible in the background .
http://134.100.15.200/flickr8k/Images/2534502836_7a75305655.jpg,A dog rolling in the grass .
http://134.100.15.200/flickr8k/Images/2534502836_7a75305655.jpg,Large dog plays with two smaller dogs on grass .
http://134.100.15.200/flickr8k/Images/2534502836_7a75305655.jpg,A tan dog runs down a wooden staircase to the green grass .
http://134.100.15.200/flickr8k/Images/2534502836_7a75305655.jpg,A brown and tan dog walks through the green grass .
http://134.100.15.200/flickr8k/Images/2534502836_7a75305655.jpg,Two dogs wearing shirts play in the green grass .
http://134.100.15.200/flickr8k/Images/2534502836_7a75305655.jpg,A small boy with braids runs through a field of tall green grass .
http://134.100.15.200/flickr8k/Images/2541104331_a2d65cfa54.jpg,Three dogs running through water .
http://134.100.15.200/flickr8k/Images/2541104331_a2d65cfa54.jpg,A dog splashes through the water .
http://134.100.15.200/flickr8k/Images/2541104331_a2d65cfa54.jpg,A black and white dog is splashing in a stream .
http://134.100.15.200/flickr8k/Images/2541104331_a2d65cfa54.jpg,A young girl plays in fountain water .
http://134.100.15.200/flickr8k/Images/2541104331_a2d65cfa54.jpg,A person swimming in water nearby rocks and a small waterfall .
http://134.100.15.200/flickr8k/Images/2542662402_d781dd7f7c.jpg,A dog wading in the water with a ball in his mouth
http://134.100.15.200/flickr8k/Images/2542662402_d781dd7f7c.jpg,A dog jumps to catch a red Frisbee in the yard .
http://134.100.15.200/flickr8k/Images/254295381_d98fa049f4.jpg,A little girl in a red snowsuit sits on a snowball in a backyard .
http://134.100.15.200/flickr8k/Images/254295381_d98fa049f4.jpg,A little girl jumps rope through a parking lot
http://134.100.15.200/flickr8k/Images/2543589122_ec3e55f434.jpg,Dogs pulling a sled in a sled race .
http://134.100.15.200/flickr8k/Images/2543589122_ec3e55f434.jpg,A dog wearing a red harness runs across a field
http://134.100.15.200/flickr8k/Images/2543589122_ec3e55f434.jpg,a dog is making a splash in a blue paddling pool .
http://134.100.15.200/flickr8k/Images/2543589122_ec3e55f434.jpg,dogs playing in a stream
http://134.100.15.200/flickr8k/Images/2543589122_ec3e55f434.jpg,Three Orca whales jump in a pool at seaworld .
http://134.100.15.200/flickr8k/Images/2543589122_ec3e55f434.jpg,A dog stands in a tide pool
http://134.100.15.200/flickr8k/Images/2543589122_ec3e55f434.jpg,Children play in an inflatable pool .
http://134.100.15.200/flickr8k/Images/2543589122_ec3e55f434.jpg,Child in blue trunks splashing in blue kiddie pool
http://134.100.15.200/flickr8k/Images/2544182005_3aa1332bf9.jpg,A young child is riding a purple bike .
http://134.100.15.200/flickr8k/Images/2544182005_3aa1332bf9.jpg,a young person playing in the snow with two black dogs .
http://134.100.15.200/flickr8k/Images/2544426580_317b1f1f73.jpg,A baby wearing a white gown waves a Muslim flag .
http://134.100.15.200/flickr8k/Images/2549968784_39bfbe44f9.jpg,A young child is wearing blue goggles and sitting in a float in a pool .
http://134.100.15.200/flickr8k/Images/2553550034_5901aa9d6c.jpg,A grey dog walks on top of a fallen tree in the woods .
http://134.100.15.200/flickr8k/Images/2553550034_5901aa9d6c.jpg,"Boy in pajamas , with red and yellow toy , seated on tire near plants ."
http://134.100.15.200/flickr8k/Images/2553550034_5901aa9d6c.jpg,A brown dog hops over a fallen tree branch .
http://134.100.15.200/flickr8k/Images/2553550034_5901aa9d6c.jpg,A man wearing red shorts is holding onto the rocks beside the water .
http://134.100.15.200/flickr8k/Images/2553550034_5901aa9d6c.jpg,Three cyclists ride through cordoned pathway near woods .
http://134.100.15.200/flickr8k/Images/2554081584_233bdf289a.jpg,The person in the yellow shirt is sitting with a child at a wooden picnic table .
http://134.100.15.200/flickr8k/Images/2554081584_233bdf289a.jpg,A teenage boy climbs an indoor climbing wall .
http://134.100.15.200/flickr8k/Images/2559503010_84f20b3bc9.jpg,A man walks toward a car in a parking lot .
http://134.100.15.200/flickr8k/Images/2559503010_84f20b3bc9.jpg,A man is hiking on a mountaintop on a cloudy day .
http://134.100.15.200/flickr8k/Images/2559503010_84f20b3bc9.jpg,People are enjoying drinks at a table outside a large brick building .
http://134.100.15.200/flickr8k/Images/2559503010_84f20b3bc9.jpg,People are standing around a scenic lookout on a sunny day .
http://134.100.15.200/flickr8k/Images/2559921948_06af25d566.jpg,A young boy in swimming trunks is walking with his arms outstretched on the beach .
http://134.100.15.200/flickr8k/Images/2559921948_06af25d566.jpg,A little boy is jumping out of the pool .
http://134.100.15.200/flickr8k/Images/2559921948_06af25d566.jpg,A little boy being splashed by water on his head
http://134.100.15.200/flickr8k/Images/2559921948_06af25d566.jpg,A boy is on the beach with a paddle in his hand as he walks through the ocean water .
http://134.100.15.200/flickr8k/Images/256085101_2c2617c5d0.jpg,A dog is chewing on someone 's finger .
http://134.100.15.200/flickr8k/Images/256085101_2c2617c5d0.jpg,The large brown dog is chasing after the little brown dog .
http://134.100.15.200/flickr8k/Images/256085101_2c2617c5d0.jpg,A brown dog leaps into the air next to a black dog on a sandy bay .
http://134.100.15.200/flickr8k/Images/256085101_2c2617c5d0.jpg,A small dog bites a ladies fingers .
http://134.100.15.200/flickr8k/Images/256085101_2c2617c5d0.jpg,A brown dog jumps over an obstacle .
http://134.100.15.200/flickr8k/Images/2573625591_70291c894a.jpg,Two girls in soccer strips are playing on a sports field .
http://134.100.15.200/flickr8k/Images/2573625591_70291c894a.jpg,Men playing soccer in a field
http://134.100.15.200/flickr8k/Images/2573625591_70291c894a.jpg,"Two dogs fight over a stick on a grassy field , a lake in the background ."
http://134.100.15.200/flickr8k/Images/2573625591_70291c894a.jpg,A collie plays with a white ball in a field of green grass .
http://134.100.15.200/flickr8k/Images/2575647360_f5de38c751.jpg,People waiting to cross the street in front of a pharmacy with lit up sign .
http://134.100.15.200/flickr8k/Images/2575647360_f5de38c751.jpg,A white dog jumps to catch a blue ball in a living room .
http://134.100.15.200/flickr8k/Images/2575647360_f5de38c751.jpg,A man and woman look back at the camera while standing in front of a red art structure .
http://134.100.15.200/flickr8k/Images/2577972703_a22c5f2a87.jpg,A brown dog sitting on grass
http://134.100.15.200/flickr8k/Images/2577972703_a22c5f2a87.jpg,A little girl wearing a pink shirt jumps off a swing .
http://134.100.15.200/flickr8k/Images/2577972703_a22c5f2a87.jpg,a girl wearfing pink swings over a creek .
http://134.100.15.200/flickr8k/Images/2577972703_a22c5f2a87.jpg,A young girl is wearing a purple shirt and pink headband .
http://134.100.15.200/flickr8k/Images/2577972703_a22c5f2a87.jpg,A kid hangs upside down on the monkey bars at a playground .
http://134.100.15.200/flickr8k/Images/2581066814_179d28f306.jpg,A group of people walking a city street in warm weather .
http://134.100.15.200/flickr8k/Images/2581066814_179d28f306.jpg,A woman riding a bike in a park
http://134.100.15.200/flickr8k/Images/2581066814_179d28f306.jpg,A man on a scenic canoe trip .
http://134.100.15.200/flickr8k/Images/2581066814_179d28f306.jpg,A man in a green and silver Mardi Gras costume in a parade .
http://134.100.15.200/flickr8k/Images/2587818583_4aa8e7b174.jpg,a white woman in a green sweater holds a smiling child whilst a smiling boy in a yellow shirt looks on .
http://134.100.15.200/flickr8k/Images/2587818583_4aa8e7b174.jpg,"A smiling boy in an orange shirt with a safari hat sits at the playground , while a boy in a blue shirt looks on ."
http://134.100.15.200/flickr8k/Images/2587818583_4aa8e7b174.jpg,A woman is holding up a child as they coming splashing down a slide into a pool .
http://134.100.15.200/flickr8k/Images/2587818583_4aa8e7b174.jpg,Children play in an inflatable pool .
http://134.100.15.200/flickr8k/Images/2587818583_4aa8e7b174.jpg,Child in blue trunks splashing in blue kiddie pool
http://134.100.15.200/flickr8k/Images/2588927489_f4da2f11ec.jpg,Two children playing with a ball on the grass .
http://134.100.15.200/flickr8k/Images/2588927489_f4da2f11ec.jpg,A young boy kicks a soccer ball while six others play but are dressed as referee .
http://134.100.15.200/flickr8k/Images/2588927489_f4da2f11ec.jpg,A dog jumps to catch a red Frisbee in the yard .
http://134.100.15.200/flickr8k/Images/2588927489_f4da2f11ec.jpg,A group of five adults stand posing in front of buildings .
http://134.100.15.200/flickr8k/Images/2589241160_3832440850.jpg,Three girls play in the sand .
http://134.100.15.200/flickr8k/Images/2589241160_3832440850.jpg,A dog with a ball in his mouth running down a road covered in leaves .
http://134.100.15.200/flickr8k/Images/2589241160_3832440850.jpg,A dog wearing a red harness runs across a field
http://134.100.15.200/flickr8k/Images/2589241160_3832440850.jpg,A dog walks on a log across a small river .
http://134.100.15.200/flickr8k/Images/2589241160_3832440850.jpg,a grey dog swimming through a river with a stick in his mouth
http://134.100.15.200/flickr8k/Images/2589241160_3832440850.jpg,A tan dog jumps into water .
http://134.100.15.200/flickr8k/Images/2594042571_2e4666507e.jpg,a white woman in a green sweater holds a smiling child whilst a smiling boy in a yellow shirt looks on .
http://134.100.15.200/flickr8k/Images/2594042571_2e4666507e.jpg,"A smiling boy in an orange shirt with a safari hat sits at the playground , while a boy in a blue shirt looks on ."
http://134.100.15.200/flickr8k/Images/2594042571_2e4666507e.jpg,two men sit on a chairlift .
http://134.100.15.200/flickr8k/Images/2594902417_f65d8866a8.jpg,A man with a big backpack is walking through a grass trail up a hill .
http://134.100.15.200/flickr8k/Images/2594902417_f65d8866a8.jpg,"A dog in a grassy field , looking up ."
http://134.100.15.200/flickr8k/Images/2594902417_f65d8866a8.jpg,Two dogs run through a field .
http://134.100.15.200/flickr8k/Images/2594902417_f65d8866a8.jpg,Brown and white dog runs through brush .
http://134.100.15.200/flickr8k/Images/2595186208_9b16fa0ee3.jpg,A grey dog walks on top of a fallen tree in the woods .
http://134.100.15.200/flickr8k/Images/2595186208_9b16fa0ee3.jpg,A dog walks on a log across a small river .
http://134.100.15.200/flickr8k/Images/2595186208_9b16fa0ee3.jpg,two conoes float down the river .
http://134.100.15.200/flickr8k/Images/2595186208_9b16fa0ee3.jpg,dogs playing in a stream
http://134.100.15.200/flickr8k/Images/2595186208_9b16fa0ee3.jpg,"A dog , possibly a basset hound , stands nose-deep in pond water ."
http://134.100.15.200/flickr8k/Images/2595186208_9b16fa0ee3.jpg,A man jumping off of some logs .
http://134.100.15.200/flickr8k/Images/2595186208_9b16fa0ee3.jpg,A shaggy dog runs down a dirt trail in a lush forest .
http://134.100.15.200/flickr8k/Images/2599444370_9e40103027.jpg,A black dog is coming out of the ocean water on the beach with something in its mouth .
http://134.100.15.200/flickr8k/Images/2599444370_9e40103027.jpg,Two black dogs are dog paddling in a sparkling blue pool .
http://134.100.15.200/flickr8k/Images/2599444370_9e40103027.jpg,A swimmer is doing the backstroke in the swimming pool .
http://134.100.15.200/flickr8k/Images/2600867924_cd502fc911.jpg,A dog wearing a red harness runs across a field
http://134.100.15.200/flickr8k/Images/2600867924_cd502fc911.jpg,Men playing soccer in a field
http://134.100.15.200/flickr8k/Images/2600867924_cd502fc911.jpg,Two dogs are standing together on a patio .
http://134.100.15.200/flickr8k/Images/2600867924_cd502fc911.jpg,A soccer player tries to kick the ball in the goal .
http://134.100.15.200/flickr8k/Images/2600867924_cd502fc911.jpg,Two dogs run through a field .
http://134.100.15.200/flickr8k/Images/2600867924_cd502fc911.jpg,a dog runs through the long grass .
http://134.100.15.200/flickr8k/Images/2602085456_d1beebcb29.jpg,A young girl with makeup and jewelry smiles .
http://134.100.15.200/flickr8k/Images/2602085456_d1beebcb29.jpg,A topless woman is covered in mud .
