image,caption,rating
http://134.100.15.200/flickr8k/Images/1056338697_4f7d7ce270.jpg,A girl wearing a yellow shirt and sunglasses smiles .,1.572676
http://134.100.15.200/flickr8k/Images/1056338697_4f7d7ce270.jpg,A man sleeps under a blanket on a city street .,1.6145574
http://134.100.15.200/flickr8k/Images/1056338697_4f7d7ce270.jpg,A woman plays with long red ribbons in an empty square .,1.9625897
http://134.100.15.200/flickr8k/Images/1056338697_4f7d7ce270.jpg,Chinese market street in the winter time .,1.1157255
http://134.100.15.200/flickr8k/Images/1056338697_4f7d7ce270.jpg,A man and woman look back at the camera while standing in front of a red art structure .,1.1349635
http://134.100.15.200/flickr8k/Images/106490881_5a2dd9b7bd.jpg,A little boy shakes the snow off of a tree .,2.3720953
http://134.100.15.200/flickr8k/Images/106490881_5a2dd9b7bd.jpg,The kid is on a float in the snow .,2.124006
http://134.100.15.200/flickr8k/Images/1082379191_ec1e53f996.jpg,A crowd of people at an outdoor event,1.7407935
http://134.100.15.200/flickr8k/Images/1082379191_ec1e53f996.jpg,A man riding a motorcycle is performing a trick at a track .,1.1936936
http://134.100.15.200/flickr8k/Images/1082379191_ec1e53f996.jpg,A man riding a blue motorcycle jumps over a ramp .,1.8496413
http://134.100.15.200/flickr8k/Images/1084040636_97d9633581.jpg,Close-up of dog in profile with mouth open .,2.1259668
http://134.100.15.200/flickr8k/Images/1084040636_97d9633581.jpg,Two brown dogs playfully fight in the snow .,1.1244226
http://134.100.15.200/flickr8k/Images/1084040636_97d9633581.jpg,A dog gets on a trampoline .,2.3008513
http://134.100.15.200/flickr8k/Images/1084040636_97d9633581.jpg,A jogger with a dog approaches a ladder truck .,1.1254786
http://134.100.15.200/flickr8k/Images/1096395242_fc69f0ae5a.jpg,A white dog jumps to catch a blue ball in a living room .,1.1262865
http://134.100.15.200/flickr8k/Images/1096395242_fc69f0ae5a.jpg,A young boy kicks a soccer ball while six others play but are dressed as referee .,1.9868387
http://134.100.15.200/flickr8k/Images/1096395242_fc69f0ae5a.jpg,Two little girls dance on a hardwood floor in the house .,2.5643623
http://134.100.15.200/flickr8k/Images/1107246521_d16a476380.jpg,Large dog plays with two smaller dogs on grass .,3.2264428
http://134.100.15.200/flickr8k/Images/1107246521_d16a476380.jpg,Two beige dogs are playing in the grass near a doghouse .,1.1389198
http://134.100.15.200/flickr8k/Images/1107246521_d16a476380.jpg,Three dogs are playing in a field .,1.7399356
http://134.100.15.200/flickr8k/Images/1119015538_e8e796281e.jpg,A dog rolling in the grass .,3.7969818
http://134.100.15.200/flickr8k/Images/1119015538_e8e796281e.jpg,A small brown and white dog running through tall grass .,4.017203
http://134.100.15.200/flickr8k/Images/1119015538_e8e796281e.jpg,A brown dog with a tennis ball its mouth rolling on its back on a grassy surface .,3.7249508
http://134.100.15.200/flickr8k/Images/1119015538_e8e796281e.jpg,Two dogs are playing together outside .,1.9153712
http://134.100.15.200/flickr8k/Images/1119015538_e8e796281e.jpg,"A white dog runs in the grass ,",3.7013118
http://134.100.15.200/flickr8k/Images/1122944218_8eb3607403.jpg,A woman holding a little girls hand is pointing to something trying to show her .,2.4921112
http://134.100.15.200/flickr8k/Images/1131800850_89c7ffd477.jpg,A brown dog shaking off water .,3.8853903
http://134.100.15.200/flickr8k/Images/1131800850_89c7ffd477.jpg,Brown and white dog jumping over a low rail with a tennis ball in his mouth .,1.5231414
http://134.100.15.200/flickr8k/Images/1131932671_c8d17751b3.jpg,A boy jumps from one bed to another .,4.073459
http://134.100.15.200/flickr8k/Images/1131932671_c8d17751b3.jpg,A child jumping on a tennis court .,1.4137516
http://134.100.15.200/flickr8k/Images/113678030_87a6a6e42e.jpg,"Laying on stones , a girl with messy hair has her head on the boy laying next to her .",2.078695
http://134.100.15.200/flickr8k/Images/113678030_87a6a6e42e.jpg,"A man in grey on a rocky cliff , overlooking the mountains .",2.5011015
http://134.100.15.200/flickr8k/Images/114051287_dd85625a04.jpg,A man with sunglasses and a woman with a hat are in front of a car .,2.3352764
http://134.100.15.200/flickr8k/Images/114051287_dd85625a04.jpg,A red car parked next to a cow in a field .,1.1632358
http://134.100.15.200/flickr8k/Images/115684808_cb01227802.jpg,Three people and a sled .,3.7398129
http://134.100.15.200/flickr8k/Images/115684808_cb01227802.jpg,Four people climbing a hill in the snow .,3.6027265
http://134.100.15.200/flickr8k/Images/115684808_cb01227802.jpg,A man jumps while snow skiing .,1.9065573
http://134.100.15.200/flickr8k/Images/115684808_cb01227802.jpg,A child sleds over a mound of snow as others watch him .,3.5376256
http://134.100.15.200/flickr8k/Images/115684808_cb01227802.jpg,A man at a rodeo is thrown off a horse .,1.1245339
http://134.100.15.200/flickr8k/Images/1167669558_87a8a467d6.jpg,A girl wearing a yellow shirt and sunglasses smiles .,2.456437
http://134.100.15.200/flickr8k/Images/1174525839_7c1e6cfa86.jpg,a little girl kicks into the air .,3.731164
http://134.100.15.200/flickr8k/Images/1174525839_7c1e6cfa86.jpg,A little girl runs on the wet sand near the ocean .,4.076378
http://134.100.15.200/flickr8k/Images/1174525839_7c1e6cfa86.jpg,A dog is running along the beach beside the ocean .,2.436025
http://134.100.15.200/flickr8k/Images/1174629344_a2e1a2bdbf.jpg,A group of people walking a city street in warm weather .,4.0784154
http://134.100.15.200/flickr8k/Images/1174629344_a2e1a2bdbf.jpg,People waiting to cross the street in front of a pharmacy with lit up sign .,3.2006989
http://134.100.15.200/flickr8k/Images/1174629344_a2e1a2bdbf.jpg,A man in a white uniform jumps while holding a basketball as another in blue blocks him .,1.1244822
http://134.100.15.200/flickr8k/Images/1174629344_a2e1a2bdbf.jpg,Two men walk through a city with words on the street .,2.3683314
http://134.100.15.200/flickr8k/Images/1174629344_a2e1a2bdbf.jpg,A woman writing while standing by men .,3.6127253
http://134.100.15.200/flickr8k/Images/1220401002_3f44b1f3f7.jpg,A small dogs ears stick up as it runs in the grass .,1.1177593
http://134.100.15.200/flickr8k/Images/1220401002_3f44b1f3f7.jpg,"A dog in a grassy field , looking up .",1.1363616
http://134.100.15.200/flickr8k/Images/1220401002_3f44b1f3f7.jpg,Two woman and a child look at each other while a night party scene goes on behind them .,3.4588575
http://134.100.15.200/flickr8k/Images/1224851143_33bcdd299c.jpg,A little boy is jumping into an outdoor kiddie pool,2.3623729
http://134.100.15.200/flickr8k/Images/1224851143_33bcdd299c.jpg,A little boy is jumping out of the pool .,1.3600916
http://134.100.15.200/flickr8k/Images/1237985362_dbafc59280.jpg,A little boy is jumping into an outdoor kiddie pool,2.3525538
http://134.100.15.200/flickr8k/Images/1248940539_46d33ed487.jpg,A young child with a dirty shirt is standing on a playground,2.6618881
http://134.100.15.200/flickr8k/Images/1248940539_46d33ed487.jpg,Three women are posing together in front of a Christmas tree .,1.3920823
http://134.100.15.200/flickr8k/Images/1248940539_46d33ed487.jpg,A happy child dangling from playground equipment smiles at the camera .,2.8657699
http://134.100.15.200/flickr8k/Images/1248940539_46d33ed487.jpg,An older couple posing in front of a fountain for a picture,1.2314243
http://134.100.15.200/flickr8k/Images/1258913059_07c613f7ff.jpg,A crowd of people at an outdoor event,3.0463762
http://134.100.15.200/flickr8k/Images/1258913059_07c613f7ff.jpg,a young man jumping a back flip off of a concrete wall .,1.1181507
http://134.100.15.200/flickr8k/Images/1258913059_07c613f7ff.jpg,A man and a woman are walking past a car with a fancy symbol on the front .,1.1241454
http://134.100.15.200/flickr8k/Images/1258913059_07c613f7ff.jpg,A woman is reading literature and sitting on the front stoop of a building .,3.0323663
http://134.100.15.200/flickr8k/Images/1262583859_653f1469a9.jpg,A man wearing a dark blue hat sits on the ground and leans against a building .,1.1817633
http://134.100.15.200/flickr8k/Images/1262583859_653f1469a9.jpg,A young child is riding a purple bike .,2.8031757
http://134.100.15.200/flickr8k/Images/1262583859_653f1469a9.jpg,A kid in a blue top leaps into a raked pile of leaves in front of trees .,1.1268036
http://134.100.15.200/flickr8k/Images/1262583859_653f1469a9.jpg,A little boy with a blue helmet rides his bike with his feet on the handlebars .,2.4509778
http://134.100.15.200/flickr8k/Images/1262583859_653f1469a9.jpg,A cyclist in a helmet and yellow jersey .,4.106155
http://134.100.15.200/flickr8k/Images/1267711451_e2a754b4f8.jpg,A furry dog attempts to dry itself by shaking the water off its coat .,1.8293266
http://134.100.15.200/flickr8k/Images/1267711451_e2a754b4f8.jpg,A brown dog shaking off water .,1.3495758
http://134.100.15.200/flickr8k/Images/1267711451_e2a754b4f8.jpg,The large brown dog is chasing after the little brown dog .,1.1998761
http://134.100.15.200/flickr8k/Images/1267711451_e2a754b4f8.jpg,A dog running with a blue toy in its mouth .,1.3905764
http://134.100.15.200/flickr8k/Images/1267711451_e2a754b4f8.jpg,Two dogs run down a dirt path in the forest .,2.0312696
http://134.100.15.200/flickr8k/Images/127488876_f2d2a89588.jpg,"The guy in the blue and white jersey is running , and the guy in the red and white jersey is falling .",1.7003995
http://134.100.15.200/flickr8k/Images/127488876_f2d2a89588.jpg,"A dog in a grassy field , looking up .",1.3870761
http://134.100.15.200/flickr8k/Images/127488876_f2d2a89588.jpg,A dog fetches a ball in a field .,1.1385943
http://134.100.15.200/flickr8k/Images/127488876_f2d2a89588.jpg,A group of five adults stand posing in front of buildings .,1.328244
http://134.100.15.200/flickr8k/Images/127490019_7c5c08cb11.jpg,A group of five adults stand posing in front of buildings .,1.1177382
http://134.100.15.200/flickr8k/Images/127490019_7c5c08cb11.jpg,People are standing around a scenic lookout on a sunny day .,3.2393556
http://134.100.15.200/flickr8k/Images/127490019_7c5c08cb11.jpg,A woman holds a fat baby with sunglasses and a denim hat .,1.4375522
http://134.100.15.200/flickr8k/Images/1282392036_5a0328eb86.jpg,A woman with holding a young girl playing with bubbles at a picnic .,2.7460957
http://134.100.15.200/flickr8k/Images/1282392036_5a0328eb86.jpg,Little girl playing on a scooter in her house .,1.5282531
http://134.100.15.200/flickr8k/Images/1282392036_5a0328eb86.jpg,A woman next to a dog which is running an obstacle course .,1.5136404
http://134.100.15.200/flickr8k/Images/1282392036_5a0328eb86.jpg,A child in Hawaiian clothing jumps and poses in a low cut yard nearby a fence and building .,1.1618584
http://134.100.15.200/flickr8k/Images/1287073593_f3d2a62455.jpg,A woman holding a black leash and a man looking down .,1.6744074
http://134.100.15.200/flickr8k/Images/1287073593_f3d2a62455.jpg,Two black dogs run through sand .,3.3911362
http://134.100.15.200/flickr8k/Images/1287073593_f3d2a62455.jpg,A person riding a snowboard jumps high over the snowy hill .,1.3007593
http://134.100.15.200/flickr8k/Images/1287073593_f3d2a62455.jpg,People are watching a snowboarder perform a trick in the air .,1.1420027
http://134.100.15.200/flickr8k/Images/1287073593_f3d2a62455.jpg,An airborne dog on a leash with a woman .,3.0161667
http://134.100.15.200/flickr8k/Images/1287475186_2dee85f1a5.jpg,Two black dogs are dog paddling in a sparkling blue pool .,1.1207561
http://134.100.15.200/flickr8k/Images/1287475186_2dee85f1a5.jpg,A swimmer is doing the backstroke in the swimming pool .,2.0601287
http://134.100.15.200/flickr8k/Images/1298295313_db1f4c6522.jpg,Boys in life jackets on a watercraft .,3.0487614
http://134.100.15.200/flickr8k/Images/1298295313_db1f4c6522.jpg,a boy jumps into the blue pool water .,3.8096948
http://134.100.15.200/flickr8k/Images/1298295313_db1f4c6522.jpg,A surfer rides a wave in a clear blue ocean .,2.8793635
http://134.100.15.200/flickr8k/Images/1298295313_db1f4c6522.jpg,A boy is about to jump into the water .,3.9915738
http://134.100.15.200/flickr8k/Images/1311388430_4ab0cd1a1f.jpg,A snowboarder jumps high in the air over a snowy hill .,2.6608646
http://134.100.15.200/flickr8k/Images/1311388430_4ab0cd1a1f.jpg,Person snowboarding at a ski slope .,1.2727755
http://134.100.15.200/flickr8k/Images/1311388430_4ab0cd1a1f.jpg,A person is in the air while riding his bicycle on top of the train on a clear blue sky day .,2.3197637
http://134.100.15.200/flickr8k/Images/1311388430_4ab0cd1a1f.jpg,A snowboarder in the air over a snowy mountain .,2.624535
http://134.100.15.200/flickr8k/Images/1322323208_c7ecb742c6.jpg,"Two children , one of which is holding a stick , are standing on the beach as the sun begins to set .",4.3827243
http://134.100.15.200/flickr8k/Images/1322323208_c7ecb742c6.jpg,A person on the beach beside the ocean at sunset .,3.9050488
http://134.100.15.200/flickr8k/Images/1322323208_c7ecb742c6.jpg,Two people walking along the beach at sunset towarn a group of people .,4.0469484
http://134.100.15.200/flickr8k/Images/1322323208_c7ecb742c6.jpg,A small girl is sitting on the cement dropping some chalk,2.5239227
http://134.100.15.200/flickr8k/Images/1322323208_c7ecb742c6.jpg,a dog on the beach .,2.2045045
http://134.100.15.200/flickr8k/Images/132489044_3be606baf7.jpg,A man in a striped shirt is demonstrating a product .,2.479148
http://134.100.15.200/flickr8k/Images/132489044_3be606baf7.jpg,A man and woman look back at the camera while standing in front of a red art structure .,1.1315323
http://134.100.15.200/flickr8k/Images/1329832826_432538d331.jpg,A person is hanging upside down from power lines .,1.2253381
http://134.100.15.200/flickr8k/Images/1329832826_432538d331.jpg,A crowd of people at an outdoor event,1.8234541
http://134.100.15.200/flickr8k/Images/1329832826_432538d331.jpg,An officer stands next to a car on a city street .,3.1147404
http://134.100.15.200/flickr8k/Images/1332722096_1e3de8ae70.jpg,People waiting to cross the street in front of a pharmacy with lit up sign .,2.776425
http://134.100.15.200/flickr8k/Images/1332722096_1e3de8ae70.jpg,"A woman crosses the street near a man , who is on his cellphone .",3.338541
http://134.100.15.200/flickr8k/Images/1332722096_1e3de8ae70.jpg,A woman is doing a backwards flip in front of a crowd of other people sitting on the sidewalk .,1.5437222
http://134.100.15.200/flickr8k/Images/1339596997_8ac29c1841.jpg,A young girl jumping over a railing or a ladder on its side .,1.1543317
http://134.100.15.200/flickr8k/Images/1339596997_8ac29c1841.jpg,A crowd of people at an outdoor event,2.4169693
http://134.100.15.200/flickr8k/Images/1339596997_8ac29c1841.jpg,A woman next to a dog which is running an obstacle course .,1.1277792
http://134.100.15.200/flickr8k/Images/1339596997_8ac29c1841.jpg,a middle aged man is standing next to a white wall underneath some catholic theme pictures .,1.1757793
http://134.100.15.200/flickr8k/Images/1339596997_8ac29c1841.jpg,A woman writing while standing by men .,1.437376
http://134.100.15.200/flickr8k/Images/1339596997_8ac29c1841.jpg,A group of children gather around a white dog on the grass outside .,1.1173888
http://134.100.15.200/flickr8k/Images/1343426964_cde3fb54e8.jpg,Two redheaded boys in brown shirts stand on a table and are fighting with sticks .,1.1942326
http://134.100.15.200/flickr8k/Images/1343426964_cde3fb54e8.jpg,"A woman in a red coat is smiling , while people in the background are walking around in winter clothing .",1.2531585
http://134.100.15.200/flickr8k/Images/1343426964_cde3fb54e8.jpg,A young boy jumps around on a blue mat with a half-smile on his face .,2.9949632
http://134.100.15.200/flickr8k/Images/1343426964_cde3fb54e8.jpg,A person wearing a red jacket and helmet walks up near the large rock .,1.2025563
http://134.100.15.200/flickr8k/Images/1343426964_cde3fb54e8.jpg,Two children kneeling down with pirate hats on,1.4759634
http://134.100.15.200/flickr8k/Images/1348304997_afe60a61df.jpg,A little boy slides down a bright red corkscrew slide .,1.7243626
http://134.100.15.200/flickr8k/Images/1348304997_afe60a61df.jpg,A little boy is leaping in the air onto a water slide .,2.9738455
http://134.100.15.200/flickr8k/Images/1348304997_afe60a61df.jpg,A kid in a blue top leaps into a raked pile of leaves in front of trees .,2.5928943
http://134.100.15.200/flickr8k/Images/1348304997_afe60a61df.jpg,A brown dog hops over a fallen tree branch .,1.1881919
http://134.100.15.200/flickr8k/Images/1352410176_af6b139734.jpg,A man kneels in the wet sand at a beach near a dog .,2.3064432
http://134.100.15.200/flickr8k/Images/1352410176_af6b139734.jpg,A man in a brown sweater and a woman smile for their video camera .,2.0534334
http://134.100.15.200/flickr8k/Images/1352410176_af6b139734.jpg,A dog is running along the beach beside the ocean .,1.4216585
http://134.100.15.200/flickr8k/Images/1352410176_af6b139734.jpg,a dog on the beach .,1.5764203
http://134.100.15.200/flickr8k/Images/1356796100_b265479721.jpg,A toddler girl in a swing is laughing .,2.4046073
http://134.100.15.200/flickr8k/Images/136552115_6dc3e7231c.jpg,A grey dog walks on top of a fallen tree in the woods .,1.1163577
http://134.100.15.200/flickr8k/Images/136552115_6dc3e7231c.jpg,A black dog jumping off a river bank near a wooded area .,1.1259118
http://134.100.15.200/flickr8k/Images/136552115_6dc3e7231c.jpg,A man riding a brown horse poses in front of a mountain scene .,1.1251363
http://134.100.15.200/flickr8k/Images/136552115_6dc3e7231c.jpg,Person in blue jacket on a bike on a dirt course with people looking from behind a red and white barrier .,1.2555645
http://134.100.15.200/flickr8k/Images/136644343_0e2b423829.jpg,"A boy smiling , leaning over a wagon filled with two large pumpkins .",3.8903933
http://134.100.15.200/flickr8k/Images/136644343_0e2b423829.jpg,A little boy in navy blue is running very fast .,3.3345144
http://134.100.15.200/flickr8k/Images/136886677_6026c622eb.jpg,Several people on top of a mountain look down at the ground .,1.1311041
http://134.100.15.200/flickr8k/Images/136886677_6026c622eb.jpg,A group of people are sitting on the porch of a brick building .,1.137193
http://134.100.15.200/flickr8k/Images/136886677_6026c622eb.jpg,A man wearing red shorts is holding onto the rocks beside the water .,2.5731916
http://134.100.15.200/flickr8k/Images/136886677_6026c622eb.jpg,A man scales a rock in the forest .,1.3134233
http://134.100.15.200/flickr8k/Images/136886677_6026c622eb.jpg,A person swimming in water nearby rocks and a small waterfall .,2.4314747
http://134.100.15.200/flickr8k/Images/136886677_6026c622eb.jpg,A person is standing on jagged rocks above the water below .,1.4121697
http://134.100.15.200/flickr8k/Images/136886677_6026c622eb.jpg,person rock climbing,1.1791856
http://134.100.15.200/flickr8k/Images/136886677_6026c622eb.jpg,Two people climb a rock overhanging water .,1.339832
http://134.100.15.200/flickr8k/Images/1386964743_9e80d96b05.jpg,"A white dog runs along a path , trailing a leash .",1.9306114
http://134.100.15.200/flickr8k/Images/1386964743_9e80d96b05.jpg,"A dog in a grassy field , looking up .",1.2430297
http://134.100.15.200/flickr8k/Images/1386964743_9e80d96b05.jpg,"A picture of Albert Einstein on a white bear statue , with a little boy standing under the bear statue 's face .",1.1385338
http://134.100.15.200/flickr8k/Images/1386964743_9e80d96b05.jpg,Two dogs run down a dirt path in the forest .,1.5894951
http://134.100.15.200/flickr8k/Images/1387785218_cee67735f5.jpg,Two girls and a woman walking on the sidewalk,2.8846712
http://134.100.15.200/flickr8k/Images/1387785218_cee67735f5.jpg,A blonde girl surfing down a sandy hill,2.8471956
http://134.100.15.200/flickr8k/Images/1389264266_8170bc1c54.jpg,A woman in a red shirt with her arm raised .,2.5642195
http://134.100.15.200/flickr8k/Images/1389264266_8170bc1c54.jpg,A girl in a black outfit with a red sash and a black headband has one hand on her waist and one extended straight out .,2.8738544
http://134.100.15.200/flickr8k/Images/1389264266_8170bc1c54.jpg,"A man and a woman walking down a street , carrying luggage .",2.3135064
http://134.100.15.200/flickr8k/Images/1392272228_cf104086e6.jpg,Three dogs running through water .,3.032863
http://134.100.15.200/flickr8k/Images/1392272228_cf104086e6.jpg,A black dog on a beach carrying a ball in its mouth .,3.1787748
http://134.100.15.200/flickr8k/Images/1392272228_cf104086e6.jpg,A white dog is running through the water onto the shore .,2.8205135
http://134.100.15.200/flickr8k/Images/1392272228_cf104086e6.jpg,A dog wading in the water with a ball in his mouth,3.0985024
http://134.100.15.200/flickr8k/Images/1392272228_cf104086e6.jpg,A black dog walking along a rocky terrain .,3.361652
http://134.100.15.200/flickr8k/Images/1394368714_3bc7c19969.jpg,A homeless man stands with a sign next to orange construction cones .,1.2018818
http://134.100.15.200/flickr8k/Images/1394368714_3bc7c19969.jpg,Three dogs running on a racing track .,1.18795
http://134.100.15.200/flickr8k/Images/1394368714_3bc7c19969.jpg,People at park sitting on benches and a woman taking care of her child in the stroller .,1.3782859
http://134.100.15.200/flickr8k/Images/1394368714_3bc7c19969.jpg,A woman holding a camera .,1.16275
http://134.100.15.200/flickr8k/Images/1394368714_3bc7c19969.jpg,"A man in a blue t-shirt holds a camera ,",1.5363564
http://134.100.15.200/flickr8k/Images/1394368714_3bc7c19969.jpg,"The legs and feet of people sitting on a wooden table , two cameras and cigarettes on it .",1.1711496
http://134.100.15.200/flickr8k/Images/1402640441_81978e32a9.jpg,boy and girl make a sand castle,2.7352538
http://134.100.15.200/flickr8k/Images/1402640441_81978e32a9.jpg,A girl with a bucket of water is being chased by a boy with a bucket of water .,1.6132649
http://134.100.15.200/flickr8k/Images/1402640441_81978e32a9.jpg,A boy plays in the sand .,3.6775775
http://134.100.15.200/flickr8k/Images/1404832008_68e432665b.jpg,A blueish green car on a dirt road splashing water on the left .,2.513063
http://134.100.15.200/flickr8k/Images/1404832008_68e432665b.jpg,Man falling off a blue surfboard in the ocean .,2.769796
http://134.100.15.200/flickr8k/Images/1404832008_68e432665b.jpg,A person swimming in water nearby rocks and a small waterfall .,2.6001575
http://134.100.15.200/flickr8k/Images/1404832008_68e432665b.jpg,Two people having a picnic by the shore .,1.3299053
http://134.100.15.200/flickr8k/Images/1404832008_68e432665b.jpg,A tan dog jumps into water .,1.7986865
http://134.100.15.200/flickr8k/Images/1408958345_68eea9a4e4.jpg,A person walks along the beach and leaves footprints in the sand .,3.8665333
http://134.100.15.200/flickr8k/Images/1408958345_68eea9a4e4.jpg,A dog is running along the beach beside the ocean .,1.3077852
http://134.100.15.200/flickr8k/Images/1408958345_68eea9a4e4.jpg,Two kids playing on a pebble beach by the water,3.7860928
http://134.100.15.200/flickr8k/Images/1408958345_68eea9a4e4.jpg,a dog on the beach .,1.4813305
http://134.100.15.200/flickr8k/Images/1408958345_68eea9a4e4.jpg,A boy is on the beach with a paddle in his hand as he walks through the ocean water .,2.701892
http://134.100.15.200/flickr8k/Images/1408958345_68eea9a4e4.jpg,A young girl holding a boogie board at the beach,3.2970142
http://134.100.15.200/flickr8k/Images/1415591512_a84644750c.jpg,A multicolor dog in a red collar crouching on the grass .,1.1713905
http://134.100.15.200/flickr8k/Images/1417031097_ab656bc4bd.jpg,a person is sliding down a brick rail on a snowboard .,2.9996789
http://134.100.15.200/flickr8k/Images/1417031097_ab656bc4bd.jpg,"Four people holding each others shoulders with a brown dog in front of them , standing on snow .",1.1520251
http://134.100.15.200/flickr8k/Images/1425069308_488e5fcf9d.jpg,A white dog jumps to catch a blue ball in a living room .,4.5389843
http://134.100.15.200/flickr8k/Images/1425069308_488e5fcf9d.jpg,A white puppy is running on a tiled floor .,2.4192228
http://134.100.15.200/flickr8k/Images/1425069308_488e5fcf9d.jpg,Large dog plays with two smaller dogs on grass .,2.7547312
http://134.100.15.200/flickr8k/Images/1425069308_488e5fcf9d.jpg,A black dog and a white dog play in the street together .,2.8279743
http://134.100.15.200/flickr8k/Images/1427391496_ea512cbe7f.jpg,A black dog jumping off of a dock .,1.2452773
http://134.100.15.200/flickr8k/Images/1427391496_ea512cbe7f.jpg,The Asian girl wearing a pink and black striped top is walking next to the girl in the grey top .,1.3621695
http://134.100.15.200/flickr8k/Images/1427391496_ea512cbe7f.jpg,A dog standing on a beach .,1.3235085
http://134.100.15.200/flickr8k/Images/1432179046_8e3d75cf81.jpg,A person on the beach beside the ocean at sunset .,2.535581
http://134.100.15.200/flickr8k/Images/1432179046_8e3d75cf81.jpg,A man wearing an orange cap sits on a white bench beside a blue trashcan .,1.2224514
http://134.100.15.200/flickr8k/Images/1432179046_8e3d75cf81.jpg,A person sits on a red bench to eat while another watches .,1.1590207
http://134.100.15.200/flickr8k/Images/1432179046_8e3d75cf81.jpg,two men sit on a chairlift .,1.1258343
http://134.100.15.200/flickr8k/Images/1433142189_cda8652603.jpg,A person is in the air while riding his bicycle on top of the train on a clear blue sky day .,1.1510379
http://134.100.15.200/flickr8k/Images/1433142189_cda8652603.jpg,A mountain biker is racing through a shaded trail .,2.6136863
http://134.100.15.200/flickr8k/Images/1433142189_cda8652603.jpg,A person is hiking to the top of a hill .,4.38449
http://134.100.15.200/flickr8k/Images/1433142189_cda8652603.jpg,A person descends a rope from a cliff into the ocean .,1.8020477
http://134.100.15.200/flickr8k/Images/143688283_a96ded20f1.jpg,A grey dog walks on top of a fallen tree in the woods .,1.1279633
http://134.100.15.200/flickr8k/Images/143688283_a96ded20f1.jpg,A little boy in a striped shirt is standing behind a tree .,1.5406857
