image,caption,rating
http://134.100.15.200/flickr8k/Images/2999730677_0cfa1c146e.jpg,Two dogs moving through water close to the shore .,1.5729854
http://134.100.15.200/flickr8k/Images/2999730677_0cfa1c146e.jpg,dogs playing in a stream,2.053278
http://134.100.15.200/flickr8k/Images/2999730677_0cfa1c146e.jpg,A brown dog hops over a fallen tree branch .,2.2092137
http://134.100.15.200/flickr8k/Images/300314926_0b2e4b64f5.jpg,Rafting boat on river .,4.1211705
http://134.100.15.200/flickr8k/Images/300314926_0b2e4b64f5.jpg,a skateboarder jumps a staircase .,2.3948162
http://134.100.15.200/flickr8k/Images/300314926_0b2e4b64f5.jpg,A person is riding in a canoe on a lake next to green trees .,3.0755744
http://134.100.15.200/flickr8k/Images/300314926_0b2e4b64f5.jpg,A man wakeboards on choppy water .,3.9707086
http://134.100.15.200/flickr8k/Images/300314926_0b2e4b64f5.jpg,A person is standing on jagged rocks above the water below .,2.3444772
http://134.100.15.200/flickr8k/Images/3003691049_f4363c2d5c.jpg,Dogs pulling a sled in a sled race .,1.6150668
http://134.100.15.200/flickr8k/Images/3003691049_f4363c2d5c.jpg,A small dog and a large dog in the snow .,2.7056222
http://134.100.15.200/flickr8k/Images/3003691049_f4363c2d5c.jpg,Two small dogs run through the grass .,2.0580297
http://134.100.15.200/flickr8k/Images/3004823335_9b82cbd8a7.jpg,A dog rolling in the grass .,3.011001
http://134.100.15.200/flickr8k/Images/3004823335_9b82cbd8a7.jpg,"A dog runs through a lush , green lawn .",4.1407743
http://134.100.15.200/flickr8k/Images/300550441_f44ec3701a.jpg,A black dog jumping off a river bank near a wooded area .,1.1713359
http://134.100.15.200/flickr8k/Images/300550441_f44ec3701a.jpg,Some kids play outside on a nice day .,1.7379051
http://134.100.15.200/flickr8k/Images/300550441_f44ec3701a.jpg,A naked woman wearing body paint riding a bicycle .,1.1879683
http://134.100.15.200/flickr8k/Images/300550441_f44ec3701a.jpg,Collie jumping over a training hurdle that is on the grass .,1.1332724
http://134.100.15.200/flickr8k/Images/300577375_26cc2773a1.jpg,People waiting to cross the street in front of a pharmacy with lit up sign .,1.7542989
http://134.100.15.200/flickr8k/Images/3006093003_c211737232.jpg,A woman in a red shirt with her arm raised .,1.1531583
http://134.100.15.200/flickr8k/Images/3006093003_c211737232.jpg,people are at a costume party .,2.8317397
http://134.100.15.200/flickr8k/Images/3006093003_c211737232.jpg,A man in a werewolf mask is with a woman wearing elf ears .,1.1381828
http://134.100.15.200/flickr8k/Images/3006093003_c211737232.jpg,A woman sings into a microphone while playing guitar .,1.170815
http://134.100.15.200/flickr8k/Images/300922408_05a4f9938c.jpg,a young man jumping a back flip off of a concrete wall .,1.1785785
http://134.100.15.200/flickr8k/Images/300922408_05a4f9938c.jpg,A brown and tan dog walks through the green grass .,1.6878095
http://134.100.15.200/flickr8k/Images/300922408_05a4f9938c.jpg,A dog is running along the beach beside the ocean .,3.571801
http://134.100.15.200/flickr8k/Images/300922408_05a4f9938c.jpg,A surfer catches a nice wave in the ocean and tries to pull himself up .,1.7065709
http://134.100.15.200/flickr8k/Images/300922408_05a4f9938c.jpg,A boy is on the beach with a paddle in his hand as he walks through the ocean water .,2.4141748
http://134.100.15.200/flickr8k/Images/3009644534_992e9ea2a7.jpg,two small brown and white dogs standing beside some white chairs,1.6665297
http://134.100.15.200/flickr8k/Images/3009644534_992e9ea2a7.jpg,Two white dogs running,3.1090033
http://134.100.15.200/flickr8k/Images/3009644534_992e9ea2a7.jpg,"A white dog runs in the grass ,",3.8567786
http://134.100.15.200/flickr8k/Images/3009644534_992e9ea2a7.jpg,A white dog with a muzzle is running through an uncut field with a fence nearby .,3.1774817
http://134.100.15.200/flickr8k/Images/3015863181_92ff43f4d8.jpg,A man looking at produce .,1.1514913
http://134.100.15.200/flickr8k/Images/3015863181_92ff43f4d8.jpg,A man in a white uniform jumps while holding a basketball as another in blue blocks him .,1.1543794
http://134.100.15.200/flickr8k/Images/3016606751_0e8be20abd.jpg,Four people climbing a hill in the snow .,1.7048872
http://134.100.15.200/flickr8k/Images/3016606751_0e8be20abd.jpg,A man wearing red shorts is holding onto the rocks beside the water .,2.663213
http://134.100.15.200/flickr8k/Images/3016606751_0e8be20abd.jpg,A man scales a rock in the forest .,3.7989726
http://134.100.15.200/flickr8k/Images/3016606751_0e8be20abd.jpg,The four people sit on a pile of rocks .,1.6470398
http://134.100.15.200/flickr8k/Images/3017521547_f5ef8848e3.jpg,Two girls in soccer strips are playing on a sports field .,3.2598696
http://134.100.15.200/flickr8k/Images/3017521547_f5ef8848e3.jpg,Two women with blue and white uniforms playing floor hockey,4.396868
http://134.100.15.200/flickr8k/Images/3017521547_f5ef8848e3.jpg,A woman is wearing a blue headscarf and a blue sweater .,2.5603027
http://134.100.15.200/flickr8k/Images/3019842612_8501c1791e.jpg,"A woman crosses the street near a man , who is on his cellphone .",1.2001157
http://134.100.15.200/flickr8k/Images/3019842612_8501c1791e.jpg,"A man is standing up , reading a newspaper , and smoking a cigar .",1.1585312
http://134.100.15.200/flickr8k/Images/3024172109_a10198e1dd.jpg,A small girl is sitting on the cement dropping some chalk,1.1620228
http://134.100.15.200/flickr8k/Images/3024172109_a10198e1dd.jpg,Kids are waiting at the bottom of a staircase attached to a brick building .,2.6594996
http://134.100.15.200/flickr8k/Images/3024172109_a10198e1dd.jpg,A man with a wake-board is diving over a surface that is not water .,4.043604
http://134.100.15.200/flickr8k/Images/3025549604_38b86198f5.jpg,A little girl runs on the wet sand near the ocean .,1.1458151
http://134.100.15.200/flickr8k/Images/3025549604_38b86198f5.jpg,Three girls in colorful outfits are dancing under a stage light .,1.5983723
http://134.100.15.200/flickr8k/Images/3025549604_38b86198f5.jpg,A man balances on his forearms while a child watches in front of a colorful background .,1.8978889
http://134.100.15.200/flickr8k/Images/3027397797_4f1d305ced.jpg,A young boy in swimming trunks is walking with his arms outstretched on the beach .,3.3687358
http://134.100.15.200/flickr8k/Images/3027397797_4f1d305ced.jpg,A man is tying a red arm band around another mans arm in the street .,1.926079
http://134.100.15.200/flickr8k/Images/3027397797_4f1d305ced.jpg,A man is diving into water near a shore .,2.613752
http://134.100.15.200/flickr8k/Images/3028969146_26929ae0e8.jpg,A white and brown dog jumps up for a white Frisbee .,3.082161
http://134.100.15.200/flickr8k/Images/3028969146_26929ae0e8.jpg,A dog rolls on the ground .,2.65326
http://134.100.15.200/flickr8k/Images/302983277_69a4e732e4.jpg,"A man in grey on a rocky cliff , overlooking the mountains .",2.495411
http://134.100.15.200/flickr8k/Images/302983277_69a4e732e4.jpg,A man sits in his tent on a mountain .,2.0355656
http://134.100.15.200/flickr8k/Images/3030294889_78b2ccbe51.jpg,a boy jumps into the blue pool water .,2.8139381
http://134.100.15.200/flickr8k/Images/3030294889_78b2ccbe51.jpg,Three Orca whales jump in a pool at seaworld .,3.85339
http://134.100.15.200/flickr8k/Images/3030566410_393c36a6c5.jpg,a boy jumps into the blue pool water .,3.0618744
http://134.100.15.200/flickr8k/Images/3030566410_393c36a6c5.jpg,A young child is wearing blue goggles and sitting in a float in a pool .,2.9062796
http://134.100.15.200/flickr8k/Images/3030566410_393c36a6c5.jpg,Two girls pass two boys by a tree in a neon lit street .,1.2317361
http://134.100.15.200/flickr8k/Images/3030566410_393c36a6c5.jpg,a toddler is with wet hair stands by swimming pool wrapped in a towel .,3.116597
http://134.100.15.200/flickr8k/Images/3030566410_393c36a6c5.jpg,A young girl in a white dress watches bubbles while a woman and girl toddler observe .,1.9637144
http://134.100.15.200/flickr8k/Images/3030566410_393c36a6c5.jpg,Two guys jumping into a pool .,2.3870358
http://134.100.15.200/flickr8k/Images/3030566410_393c36a6c5.jpg,Children play in an inflatable pool .,3.8194432
http://134.100.15.200/flickr8k/Images/3040033126_9f4b88261b.jpg,"A man in grey on a rocky cliff , overlooking the mountains .",1.1390605
http://134.100.15.200/flickr8k/Images/3042380610_c5ea61eef8.jpg,"A man in a bright green shirt riding a bicycle in a paved courtyard , carying a drink .",1.4376327
http://134.100.15.200/flickr8k/Images/3042380610_c5ea61eef8.jpg,Two people are sitting next to a wood-stacked campfire at night .,1.340761
http://134.100.15.200/flickr8k/Images/3042380610_c5ea61eef8.jpg,a middle aged man is standing next to a white wall underneath some catholic theme pictures .,1.7255874
http://134.100.15.200/flickr8k/Images/3042380610_c5ea61eef8.jpg,A man is holding up a small poster with two people in it .,1.8337053
http://134.100.15.200/flickr8k/Images/3042380610_c5ea61eef8.jpg,Men burn an Israeli flag .,1.1281496
http://134.100.15.200/flickr8k/Images/3042380610_c5ea61eef8.jpg,A group of performers dancing in front of two DJs .,2.1305046
http://134.100.15.200/flickr8k/Images/3042380610_c5ea61eef8.jpg,A woman posing with a statue alongside a group of boys,1.6335258
http://134.100.15.200/flickr8k/Images/3042380610_c5ea61eef8.jpg,Two women with black hair stand in front of plywood .,1.7676523
http://134.100.15.200/flickr8k/Images/3044500219_778f9f2b71.jpg,A young girl in a white dress watches bubbles while a woman and girl toddler observe .,1.176129
http://134.100.15.200/flickr8k/Images/3044500219_778f9f2b71.jpg,Two women are dancing while men play music behind them .,3.0049648
http://134.100.15.200/flickr8k/Images/3044500219_778f9f2b71.jpg,Three girls in colorful outfits are dancing under a stage light .,2.2361152
http://134.100.15.200/flickr8k/Images/3044500219_778f9f2b71.jpg,A girl is wear a green dress .,1.8435277
http://134.100.15.200/flickr8k/Images/3044536048_e615466e7f.jpg,Two people run down the beach and one of them is pointing .,2.4881063
http://134.100.15.200/flickr8k/Images/3044536048_e615466e7f.jpg,A man is attempting a stunt with a bicycle .,2.2166376
http://134.100.15.200/flickr8k/Images/3044536048_e615466e7f.jpg,a surfer is riding his board over a wave .,4.0295568
http://134.100.15.200/flickr8k/Images/3044536048_e615466e7f.jpg,A surfer is riding a wave .,3.8019106
http://134.100.15.200/flickr8k/Images/3044746136_8b89da5f40.jpg,A conference is being held that involves laptops and big screen presentations .,4.6064487
http://134.100.15.200/flickr8k/Images/3044746136_8b89da5f40.jpg,Children sit in front of a computer while their teacher instructs them .,3.195418
http://134.100.15.200/flickr8k/Images/3044746136_8b89da5f40.jpg,A group of people are sitting on the steps outside .,1.7454635
http://134.100.15.200/flickr8k/Images/3045613316_4e88862836.jpg,A dog stands at the top of a mountain and looks on .,1.339408
http://134.100.15.200/flickr8k/Images/3045613316_4e88862836.jpg,A hiker is pointing towards the mountains .,3.9351397
http://134.100.15.200/flickr8k/Images/3045613316_4e88862836.jpg,A small boy with braids runs through a field of tall green grass .,2.2272213
http://134.100.15.200/flickr8k/Images/3045613316_4e88862836.jpg,A man sits in his tent on a mountain .,1.4175069
http://134.100.15.200/flickr8k/Images/3047264346_e24601bfbf.jpg,A man wearing all black and a black hat is smiling .,3.2032428
http://134.100.15.200/flickr8k/Images/3047264346_e24601bfbf.jpg,A woman wearing a white glove peers over the crowd .,1.2010472
http://134.100.15.200/flickr8k/Images/3047264346_e24601bfbf.jpg,A man in a werewolf mask is with a woman wearing elf ears .,3.7050974
http://134.100.15.200/flickr8k/Images/3047264346_e24601bfbf.jpg,A man jumping off of some logs .,1.1179837
http://134.100.15.200/flickr8k/Images/3048597471_5697538daf.jpg,A young boy in a swimming suit sits in water .,2.7758563
http://134.100.15.200/flickr8k/Images/3048597471_5697538daf.jpg,A dog wading in the water with a ball in his mouth,4.124037
http://134.100.15.200/flickr8k/Images/3048597471_5697538daf.jpg,A man in a uniform playing with a black dog .,1.1419301
http://134.100.15.200/flickr8k/Images/3048597471_5697538daf.jpg,a smiling toddler in a pink swimsuit is laying in the water .,3.355679
http://134.100.15.200/flickr8k/Images/3048597471_5697538daf.jpg,A young girl stands under three large rings that shoot water in a water park .,1.2522314
http://134.100.15.200/flickr8k/Images/3051384385_c5c850c1f8.jpg,Group of children in blue uniforms sitting on steps .,1.3830377
http://134.100.15.200/flickr8k/Images/3053743109_a2d780c0d2.jpg,People gathered in an artist 's studio .,1.1947145
http://134.100.15.200/flickr8k/Images/3053743109_a2d780c0d2.jpg,A kid in a blue top leaps into a raked pile of leaves in front of trees .,1.1283834
http://134.100.15.200/flickr8k/Images/3053743109_a2d780c0d2.jpg,"two guy standing on horses , while a crowd watches",1.4954807
http://134.100.15.200/flickr8k/Images/3058439373_9276a4702a.jpg,A group of people walking a city street in warm weather .,3.2674685
http://134.100.15.200/flickr8k/Images/3058439373_9276a4702a.jpg,A man in a suit dances with a young girl in front of an audience .,1.9896619
http://134.100.15.200/flickr8k/Images/3058439373_9276a4702a.jpg,Many bundled up people are standing in a public square .,3.8309507
http://134.100.15.200/flickr8k/Images/3058439373_9276a4702a.jpg,A group of five adults stand posing in front of buildings .,3.0145574
http://134.100.15.200/flickr8k/Images/3058439373_9276a4702a.jpg,"A man and a woman walking down a street , carrying luggage .",1.4760826
http://134.100.15.200/flickr8k/Images/3061481868_d1e00b1f2e.jpg,A woman riding a bike in a park,2.2330008
http://134.100.15.200/flickr8k/Images/3061481868_d1e00b1f2e.jpg,A man riding a motorcycle is performing a trick at a track .,2.852573
http://134.100.15.200/flickr8k/Images/3062173277_bfb5ef4c45.jpg,"A young boy , playing basketball , is getting ready to take a shot .",1.1882954
http://134.100.15.200/flickr8k/Images/3062173277_bfb5ef4c45.jpg,A topless woman is covered in mud .,1.6638249
http://134.100.15.200/flickr8k/Images/3062173277_bfb5ef4c45.jpg,two conoes float down the river .,3.1407933
http://134.100.15.200/flickr8k/Images/3062173277_bfb5ef4c45.jpg,People trackside at a subway station by a train .,1.1193776
http://134.100.15.200/flickr8k/Images/3062173277_bfb5ef4c45.jpg,A musician and a crowd next to stage full of musical instruments .,1.1858428
http://134.100.15.200/flickr8k/Images/3064383768_f6838f57da.jpg,A man is attempting a stunt with a bicycle .,1.9564005
http://134.100.15.200/flickr8k/Images/3064383768_f6838f57da.jpg,Boat number 5 has several men with life jackets paddling the water .,1.3592427
http://134.100.15.200/flickr8k/Images/3064383768_f6838f57da.jpg,A surfer is riding a wave .,4.2986355
http://134.100.15.200/flickr8k/Images/3070011270_390e597783.jpg,A small dog and a large dog in the snow .,3.4244413
http://134.100.15.200/flickr8k/Images/3070011270_390e597783.jpg,three black dogs and a white dog are standing in the snow .,1.7345924
http://134.100.15.200/flickr8k/Images/3070011270_390e597783.jpg,A golden dog looks alert as he stands in snow .,1.8567266
http://134.100.15.200/flickr8k/Images/3070031806_3d587c2a66.jpg,Two dogs are running towards each other on a beach .,3.7734227
http://134.100.15.200/flickr8k/Images/3070031806_3d587c2a66.jpg,A blonde girl surfing down a sandy hill,1.1956544
http://134.100.15.200/flickr8k/Images/3070031806_3d587c2a66.jpg,Two children playing in a spray of water .,1.1276969
http://134.100.15.200/flickr8k/Images/3070031806_3d587c2a66.jpg,A dog is running along the beach beside the ocean .,3.8663464
http://134.100.15.200/flickr8k/Images/3070031806_3d587c2a66.jpg,Two dogs run across the barren ground .,3.4441295
http://134.100.15.200/flickr8k/Images/3071676551_a65741e372.jpg,a surfer is riding his board over a wave .,4.258356
http://134.100.15.200/flickr8k/Images/3071676551_a65741e372.jpg,A surfer is riding a wave .,4.329299
http://134.100.15.200/flickr8k/Images/3071676551_a65741e372.jpg,A surfer rides a wave in a clear blue ocean .,4.3140564
http://134.100.15.200/flickr8k/Images/3072114570_e1c0127529.jpg,almost 2 dozen people are riding on the outside of a cart down a road,1.5230799
http://134.100.15.200/flickr8k/Images/3072114570_e1c0127529.jpg,Some kids play outside on a nice day .,3.6302552
http://134.100.15.200/flickr8k/Images/3072114570_e1c0127529.jpg,Two men walk through a city with words on the street .,1.3174814
http://134.100.15.200/flickr8k/Images/3072172967_630e9c69d0.jpg,Children play in a water spray .,1.1283479
http://134.100.15.200/flickr8k/Images/3072172967_630e9c69d0.jpg,"Four men playing basketball , two from each team .",3.7834575
http://134.100.15.200/flickr8k/Images/3072172967_630e9c69d0.jpg,A group of five adults stand posing in front of buildings .,1.2631503
http://134.100.15.200/flickr8k/Images/307327914_f98f576adb.jpg,Man dressed up in black and brown and holding a white light saber .,3.194789
http://134.100.15.200/flickr8k/Images/307327914_f98f576adb.jpg,A man in a white print shirt and a woman in a black dress dancing .,2.4927523
http://134.100.15.200/flickr8k/Images/307327914_f98f576adb.jpg,A person on a skateboard .,1.1540871
http://134.100.15.200/flickr8k/Images/307327914_f98f576adb.jpg,A man and woman look back at the camera while standing in front of a red art structure .,1.4625998
http://134.100.15.200/flickr8k/Images/3074842262_62b1b2168c.jpg,A dog with a ball in his mouth running down a road covered in leaves .,2.144252
http://134.100.15.200/flickr8k/Images/3074842262_62b1b2168c.jpg,Two puppies are playing in the leaves .,2.4380248
http://134.100.15.200/flickr8k/Images/3074842262_62b1b2168c.jpg,A man with dreadlocks and a backpack walks down the sidewalk with colorful buildings in the background .,1.470174
http://134.100.15.200/flickr8k/Images/3079787482_0757e9d167.jpg,A young girl with makeup and jewelry smiles .,3.1036353
http://134.100.15.200/flickr8k/Images/3079787482_0757e9d167.jpg,A young boy is holding a book .,1.3083023
http://134.100.15.200/flickr8k/Images/3079787482_0757e9d167.jpg,Two men and a woman smile at the camera .,1.1381687
http://134.100.15.200/flickr8k/Images/3079787482_0757e9d167.jpg,a young man wearing dark sunglasses smiling,1.1314839
http://134.100.15.200/flickr8k/Images/3080056515_3013830309.jpg,"A man , woman and one girl face the camera , while one girl faces away .",3.0413027
http://134.100.15.200/flickr8k/Images/3080056515_3013830309.jpg,A little girl is sliding down a tunnel smiling .,1.7210046
http://134.100.15.200/flickr8k/Images/308487515_7852928f90.jpg,A large white bird flying over water .,2.8625243
http://134.100.15.200/flickr8k/Images/308487515_7852928f90.jpg,A bird with its wings spread,3.1440086
http://134.100.15.200/flickr8k/Images/3085226474_62aba51179.jpg,Two woman in colorful costumes look at a little girl wearing a brown vest .,1.2925551
http://134.100.15.200/flickr8k/Images/3085226474_62aba51179.jpg,A young girl in a white dress watches bubbles while a woman and girl toddler observe .,1.4946815
http://134.100.15.200/flickr8k/Images/3085667767_66041b202e.jpg,Man falling off a blue surfboard in the ocean .,3.5362759
http://134.100.15.200/flickr8k/Images/3085667767_66041b202e.jpg,A surfer is riding a wave .,4.331109
http://134.100.15.200/flickr8k/Images/3085667767_66041b202e.jpg,A surfer in all black is riding a wave .,3.261394
http://134.100.15.200/flickr8k/Images/3085667767_66041b202e.jpg,A surfer rides a wave in a clear blue ocean .,4.0889087
http://134.100.15.200/flickr8k/Images/3085667865_fa001816be.jpg,A man is sky surfing on the water .,4.1320386
http://134.100.15.200/flickr8k/Images/3085667865_fa001816be.jpg,A surfer is jumping a wave .,4.08827
http://134.100.15.200/flickr8k/Images/3085667865_fa001816be.jpg,A surfer is flipping up in the air on a surfboard .,4.5917196
http://134.100.15.200/flickr8k/Images/3085667865_fa001816be.jpg,A surfer in water and foam .,3.9298851
http://134.100.15.200/flickr8k/Images/3095225232_2e6e6dc92e.jpg,"A smiling boy in an orange shirt with a safari hat sits at the playground , while a boy in a blue shirt looks on .",1.1665736
http://134.100.15.200/flickr8k/Images/3095225232_2e6e6dc92e.jpg,Kids are waiting at the bottom of a staircase attached to a brick building .,3.1781888
http://134.100.15.200/flickr8k/Images/309687244_4bdf3b591f.jpg,"A young man climbs a mountain , another follows below .",3.557033
http://134.100.15.200/flickr8k/Images/309687244_4bdf3b591f.jpg,A rock climber climbs in between two very large rocks .,4.4933004
http://134.100.15.200/flickr8k/Images/309687244_4bdf3b591f.jpg,A man scales a rock climbing wall .,4.2251472
http://134.100.15.200/flickr8k/Images/309687244_4bdf3b591f.jpg,A man in a white print shirt and a woman in a black dress dancing .,1.2163147
http://134.100.15.200/flickr8k/Images/309687244_4bdf3b591f.jpg,person rock climbing,4.211099
http://134.100.15.200/flickr8k/Images/3099923914_fd450f6d51.jpg,The girls were in the crowd .,3.0204477
http://134.100.15.200/flickr8k/Images/3099923914_fd450f6d51.jpg,A group of people are sitting on the porch of a brick building .,3.4158175
http://134.100.15.200/flickr8k/Images/3099923914_fd450f6d51.jpg,A crowd of people stands attentively in a plaza with buildings in the background .,2.9393182
http://134.100.15.200/flickr8k/Images/3099923914_fd450f6d51.jpg,A man at a rodeo is thrown off a horse .,1.1308414
http://134.100.15.200/flickr8k/Images/3100251515_c68027cc22.jpg,A group of people walking a city street in warm weather .,2.7678075
http://134.100.15.200/flickr8k/Images/3100251515_c68027cc22.jpg,Two people run down the beach and one of them is pointing .,1.1237344
http://134.100.15.200/flickr8k/Images/3100251515_c68027cc22.jpg,A crowd of people stands attentively in a plaza with buildings in the background .,2.041718
http://134.100.15.200/flickr8k/Images/3106026005_473a7b1c8c.jpg,A man wearing a dark blue hat sits on the ground and leans against a building .,2.5850663
http://134.100.15.200/flickr8k/Images/3106026005_473a7b1c8c.jpg,"A woman crosses the street near a man , who is on his cellphone .",1.663455
http://134.100.15.200/flickr8k/Images/3106026005_473a7b1c8c.jpg,"A man in a blue t-shirt holds a camera ,",2.3310118
http://134.100.15.200/flickr8k/Images/3107513635_fe8a21f148.jpg,A group of people walking a city street in warm weather .,2.4548316
http://134.100.15.200/flickr8k/Images/3107513635_fe8a21f148.jpg,A group of students in uniform stand in front of the gate .,3.6180072
http://134.100.15.200/flickr8k/Images/3107513635_fe8a21f148.jpg,"Three men are staring at the big , green hills in the distance .",1.2073178
http://134.100.15.200/flickr8k/Images/3107513635_fe8a21f148.jpg,"A woman in a red coat is smiling , while people in the background are walking around in winter clothing .",2.885895
http://134.100.15.200/flickr8k/Images/3107513635_fe8a21f148.jpg,A group of men are playing rugby .,1.1276538
http://134.100.15.200/flickr8k/Images/3107513635_fe8a21f148.jpg,A man is standing on his hands on a sidewalk while others watch .,3.135827
http://134.100.15.200/flickr8k/Images/3108197858_441ff38565.jpg,A group of students in uniform stand in front of the gate .,2.5969293
http://134.100.15.200/flickr8k/Images/3108197858_441ff38565.jpg,A group of people with their backs to the camera and a little girl facing a lady .,3.0284643
http://134.100.15.200/flickr8k/Images/3108197858_441ff38565.jpg,"A man is standing up , reading a newspaper , and smoking a cigar .",1.2376047
http://134.100.15.200/flickr8k/Images/3108197858_441ff38565.jpg,a group of people sitting outside in the dirt on the ground .,1.1467557
http://134.100.15.200/flickr8k/Images/3108197858_441ff38565.jpg,A woman posing with a statue alongside a group of boys,2.1662483
http://134.100.15.200/flickr8k/Images/3108197858_441ff38565.jpg,The people are in older looking attire .,1.8250133
http://134.100.15.200/flickr8k/Images/3108732084_565b423162.jpg,Snowboarders sitting in the snow while skiers take the hill .,2.8637733
http://134.100.15.200/flickr8k/Images/3108732084_565b423162.jpg,Three dogs in the snow .,1.174522
http://134.100.15.200/flickr8k/Images/3108732084_565b423162.jpg,A dog runs through the deep snow .,1.1761137
http://134.100.15.200/flickr8k/Images/3108732084_565b423162.jpg,A person riding a snowboard jumps high over the snowy hill .,4.3457828
http://134.100.15.200/flickr8k/Images/3108732084_565b423162.jpg,A dog in the snow carrying a tree limb in its mouth .,1.1199247
http://134.100.15.200/flickr8k/Images/3108732084_565b423162.jpg,One mountaineer is kneeling on the ground next to another mountaineer who is standing .,3.1792026
http://134.100.15.200/flickr8k/Images/3109704348_c6416244ce.jpg,Two girls in soccer strips are playing on a sports field .,2.4917002
http://134.100.15.200/flickr8k/Images/3109704348_c6416244ce.jpg,Men playing soccer in a field,3.775616
http://134.100.15.200/flickr8k/Images/3109704348_c6416244ce.jpg,A soccer player jumping in air during a game .,3.563296
http://134.100.15.200/flickr8k/Images/3110649716_c17e14670e.jpg,A group of people walking a city street in warm weather .,2.6968985
http://134.100.15.200/flickr8k/Images/3110649716_c17e14670e.jpg,Three young adults look towards the camera in a school setting .,1.2020904
http://134.100.15.200/flickr8k/Images/3110649716_c17e14670e.jpg,"Two men are talking on the street ; one is pointing at a sign that says "" Jesus or Hell "" beneath a red box , and the other is standing there listening .",1.7474624
http://134.100.15.200/flickr8k/Images/3110649716_c17e14670e.jpg,A crowd of people stands attentively in a plaza with buildings in the background .,2.2456412
http://134.100.15.200/flickr8k/Images/3110649716_c17e14670e.jpg,The young adults take a group shot of themselves .,1.5628169
