Image,Caption
http://134.100.15.200/flickr8k/Images/339658315_fbb178c252.jpg,A young girl in a white dress watches bubbles while a woman and girl toddler observe .
http://134.100.15.200/flickr8k/Images/339658315_fbb178c252.jpg,A girl is wear a green dress .
http://134.100.15.200/flickr8k/Images/339658315_fbb178c252.jpg,"Crowded Mexican restaurant , empty chair in foreground ."
http://134.100.15.200/flickr8k/Images/3397220683_4aca010f86.jpg,Three dogs in the snow .
http://134.100.15.200/flickr8k/Images/3397220683_4aca010f86.jpg,three black dogs and a white dog are standing in the snow .
http://134.100.15.200/flickr8k/Images/3398746625_5199beea71.jpg,Man fly fishing in a small river with steam in the background .
http://134.100.15.200/flickr8k/Images/3398746625_5199beea71.jpg,A sunset sky over rippling water .
http://134.100.15.200/flickr8k/Images/3398746625_5199beea71.jpg,A mist overshadows a man in winter gear and the winter landscape in front of him .
http://134.100.15.200/flickr8k/Images/3399284917_721aefe2a7.jpg,A young girl standing in front of a fountain
http://134.100.15.200/flickr8k/Images/3399284917_721aefe2a7.jpg,A girl walks toward a herd of sheep in the distance .
http://134.100.15.200/flickr8k/Images/3399284917_721aefe2a7.jpg,Two kids playing on a pebble beach by the water
http://134.100.15.200/flickr8k/Images/3399284917_721aefe2a7.jpg,A child swinging on a playground play set .
http://134.100.15.200/flickr8k/Images/3406930103_4db7b4dde0.jpg,A toddler in a red jacket is balancing on top of snow .
http://134.100.15.200/flickr8k/Images/3406930103_4db7b4dde0.jpg,Three dogs in the snow .
http://134.100.15.200/flickr8k/Images/3411393875_a9ff73c67a.jpg,A man in a red helmet has water squirted in his mouth by another man in a boxing ring .
http://134.100.15.200/flickr8k/Images/3411393875_a9ff73c67a.jpg,A soccer team wearing red posing together .
http://134.100.15.200/flickr8k/Images/3411393875_a9ff73c67a.jpg,People stand outside near a concrete wall and a window .
http://134.100.15.200/flickr8k/Images/3413571342_b9855795e2.jpg,Two black dogs are dog paddling in a sparkling blue pool .
http://134.100.15.200/flickr8k/Images/3413571342_b9855795e2.jpg,A dog swims in a pool near a person .
http://134.100.15.200/flickr8k/Images/3413571342_b9855795e2.jpg,A surfer rides a wave in a clear blue ocean .
http://134.100.15.200/flickr8k/Images/3416091866_a96003d652.jpg,Man dressed up in black and brown and holding a white light saber .
http://134.100.15.200/flickr8k/Images/3416091866_a96003d652.jpg,Three women are posing together in front of a Christmas tree .
http://134.100.15.200/flickr8k/Images/3416091866_a96003d652.jpg,A man is performing a handstand on the beach .
http://134.100.15.200/flickr8k/Images/3416091866_a96003d652.jpg,People are standing around a scenic lookout on a sunny day .
http://134.100.15.200/flickr8k/Images/3416091866_a96003d652.jpg,"Crowded Mexican restaurant , empty chair in foreground ."
http://134.100.15.200/flickr8k/Images/3421789737_f625dd17ed.jpg,A small boy in a horizontal tire swing .
http://134.100.15.200/flickr8k/Images/3421789737_f625dd17ed.jpg,a boy jumps into the blue pool water .
http://134.100.15.200/flickr8k/Images/3421789737_f625dd17ed.jpg,A little boy is jumping out of the pool .
http://134.100.15.200/flickr8k/Images/3422458549_f3f3878dbf.jpg,A martial artist breaks a brick .
http://134.100.15.200/flickr8k/Images/3422458549_f3f3878dbf.jpg,A tennis player in orange is striking the ball with her racquet .
http://134.100.15.200/flickr8k/Images/3422458549_f3f3878dbf.jpg,a woman wearing a black and white outfit while holding her sunglasses .
http://134.100.15.200/flickr8k/Images/3424424006_98f9d1921c.jpg,A skateboarder jumps his board down a flight of stairs .
http://134.100.15.200/flickr8k/Images/3424424006_98f9d1921c.jpg,a skateboarder jumps a staircase .
http://134.100.15.200/flickr8k/Images/3424424006_98f9d1921c.jpg,A man in a white uniform jumps while holding a basketball as another in blue blocks him .
http://134.100.15.200/flickr8k/Images/3424424006_98f9d1921c.jpg,A man reaches toward dunking a basketball while an audience watches .
http://134.100.15.200/flickr8k/Images/3424424006_98f9d1921c.jpg,A woman looking at view of a city .
http://134.100.15.200/flickr8k/Images/3425835357_204e620a66.jpg,"A man in a bright green shirt riding a bicycle in a paved courtyard , carying a drink ."
http://134.100.15.200/flickr8k/Images/3425835357_204e620a66.jpg,A young woman watches as a young blond boy swings in a chair swing with buildings visible in the background .
http://134.100.15.200/flickr8k/Images/3425835357_204e620a66.jpg,A young boy dressed in a red uniform kicks the soccer ball on the field as another child in blue watches from behind .
http://134.100.15.200/flickr8k/Images/3425835357_204e620a66.jpg,a young child in a purple shirt hanging upside down on a swing
http://134.100.15.200/flickr8k/Images/3425851292_de92a072ee.jpg,A man without a shirt playing tennis .
http://134.100.15.200/flickr8k/Images/3425851292_de92a072ee.jpg,A man and a woman wearing decorative costumes and dancing in a crowd of onlookers .
http://134.100.15.200/flickr8k/Images/3425851292_de92a072ee.jpg,A tennis player in orange is striking the ball with her racquet .
http://134.100.15.200/flickr8k/Images/3425851292_de92a072ee.jpg,A tennis player is carrying a tennis racket .
http://134.100.15.200/flickr8k/Images/3427118504_93126c83e0.jpg,A profile of a young person with a punk hairstyle and pierced ear and nose in a cowboy shirt .
http://134.100.15.200/flickr8k/Images/3427118504_93126c83e0.jpg,A man with black-rimmed glasses and a mustache is talking .
http://134.100.15.200/flickr8k/Images/3427118504_93126c83e0.jpg,A man in a striped shirt is demonstrating a product .
http://134.100.15.200/flickr8k/Images/3427233064_6af01bfc5c.jpg,A little girl in a red snowsuit sits on a snowball in a backyard .
http://134.100.15.200/flickr8k/Images/3427233064_6af01bfc5c.jpg,"two guy standing on horses , while a crowd watches"
http://134.100.15.200/flickr8k/Images/3429956016_3c7e3096c2.jpg,Three people and a sled .
http://134.100.15.200/flickr8k/Images/3429956016_3c7e3096c2.jpg,A man scales a rock climbing wall .
http://134.100.15.200/flickr8k/Images/3429956016_3c7e3096c2.jpg,A man steps off of a boulder .
http://134.100.15.200/flickr8k/Images/3429956016_3c7e3096c2.jpg,A man climbs up a sheer wall of ice .
http://134.100.15.200/flickr8k/Images/3430607596_7e4f74e3ff.jpg,A black dog is coming out of the ocean water on the beach with something in its mouth .
http://134.100.15.200/flickr8k/Images/3430607596_7e4f74e3ff.jpg,A swimmer is doing the backstroke in the swimming pool .
http://134.100.15.200/flickr8k/Images/3430607596_7e4f74e3ff.jpg,a brown and black dog swimming in a river
http://134.100.15.200/flickr8k/Images/343218198_1ca90e0734.jpg,Two children playing with a ball on the grass .
http://134.100.15.200/flickr8k/Images/343218198_1ca90e0734.jpg,A dog jumps to catch a red Frisbee in the yard .
http://134.100.15.200/flickr8k/Images/343218198_1ca90e0734.jpg,A brown dog jumps over an obstacle .
http://134.100.15.200/flickr8k/Images/343218198_1ca90e0734.jpg,A dog jumps over an obstacle .
http://134.100.15.200/flickr8k/Images/343218198_1ca90e0734.jpg,A young boy dressed in a red uniform kicks the soccer ball on the field as another child in blue watches from behind .
http://134.100.15.200/flickr8k/Images/3432550415_e7b77232de.jpg,A man in a black cap is opening a bag beside a bicycle and a shopping cart .
http://134.100.15.200/flickr8k/Images/3432550415_e7b77232de.jpg,two men posing with their legs up with a train in the background
http://134.100.15.200/flickr8k/Images/3433982387_3fa993cf5a.jpg,A man and a woman wearing decorative costumes and dancing in a crowd of onlookers .
http://134.100.15.200/flickr8k/Images/3433982387_3fa993cf5a.jpg,A woman wearing a hat and red scarf stands among others wearing similar clothes .
http://134.100.15.200/flickr8k/Images/3433982387_3fa993cf5a.jpg,Two boxers with white gloves are fighting .
http://134.100.15.200/flickr8k/Images/3433982387_3fa993cf5a.jpg,The woman wearing a red bow walks past a bicycle .
http://134.100.15.200/flickr8k/Images/3435035138_af32890a4c.jpg,A grey dog walks on top of a fallen tree in the woods .
http://134.100.15.200/flickr8k/Images/3435035138_af32890a4c.jpg,A small white dogs leaps over the back of a larger dog to chase his toy .
http://134.100.15.200/flickr8k/Images/3435035138_af32890a4c.jpg,A motocross bike is being ridden along a woodland path .
http://134.100.15.200/flickr8k/Images/3435035138_af32890a4c.jpg,A mountain biker is racing through a shaded trail .
http://134.100.15.200/flickr8k/Images/3435035138_af32890a4c.jpg,A shaggy dog runs down a dirt trail in a lush forest .
http://134.100.15.200/flickr8k/Images/3435035138_af32890a4c.jpg,A black dog standing in shallow water with a pink ball in its mouth .
http://134.100.15.200/flickr8k/Images/3436063693_15c8d377a2.jpg,A brown dog sitting on grass
http://134.100.15.200/flickr8k/Images/3436063693_15c8d377a2.jpg,Two dark colored dogs romp in the grass with a blue Frisbee .
http://134.100.15.200/flickr8k/Images/3436063693_15c8d377a2.jpg,"Two dogs , one brown and white and one black and white , run on a field ."
http://134.100.15.200/flickr8k/Images/3436063693_15c8d377a2.jpg,A dog jumping off a fence and another dog on the grass in the background .
http://134.100.15.200/flickr8k/Images/3436063693_15c8d377a2.jpg,"A dog in a grassy field , looking up ."
http://134.100.15.200/flickr8k/Images/3437147889_4cf26dd525.jpg,Two people run down the beach and one of them is pointing .
http://134.100.15.200/flickr8k/Images/3437147889_4cf26dd525.jpg,A man riding a motorcycle is performing a trick at a track .
http://134.100.15.200/flickr8k/Images/3437147889_4cf26dd525.jpg,A motorcyclist races around a track .
http://134.100.15.200/flickr8k/Images/3439382048_d2e23b2b4c.jpg,People gathered in an artist 's studio .
http://134.100.15.200/flickr8k/Images/3439382048_d2e23b2b4c.jpg,A man is doing tricks with a bicycle at a skate park .
http://134.100.15.200/flickr8k/Images/3439382048_d2e23b2b4c.jpg,Men burn an Israeli flag .
http://134.100.15.200/flickr8k/Images/3442242092_e579538d82.jpg,The girls were in the crowd .
http://134.100.15.200/flickr8k/Images/3442242092_e579538d82.jpg,A man and a woman wearing decorative costumes and dancing in a crowd of onlookers .
http://134.100.15.200/flickr8k/Images/3442242092_e579538d82.jpg,Many bundled up people are standing in a public square .
http://134.100.15.200/flickr8k/Images/3442242092_e579538d82.jpg,A young girl in a white dress watches bubbles while a woman and girl toddler observe .
http://134.100.15.200/flickr8k/Images/3442242092_e579538d82.jpg,Three girls in colorful outfits are dancing under a stage light .
http://134.100.15.200/flickr8k/Images/3449114979_6cdc3e8da8.jpg,A young woman watches as a young blond boy swings in a chair swing with buildings visible in the background .
http://134.100.15.200/flickr8k/Images/3449114979_6cdc3e8da8.jpg,A group of children gather around a white dog on the grass outside .
http://134.100.15.200/flickr8k/Images/3450874870_c4dcf58fb3.jpg,Snowboarders sitting in the snow while skiers take the hill .
http://134.100.15.200/flickr8k/Images/3450874870_c4dcf58fb3.jpg,a skier is throwing up snow as he skis off piste .
http://134.100.15.200/flickr8k/Images/3450874870_c4dcf58fb3.jpg,A person skis downhill .
http://134.100.15.200/flickr8k/Images/3450874870_c4dcf58fb3.jpg,A golden dog looks alert as he stands in snow .
http://134.100.15.200/flickr8k/Images/3452127051_fa54a902b3.jpg,A woman next to a dog which is running an obstacle course .
http://134.100.15.200/flickr8k/Images/3452127051_fa54a902b3.jpg,The dog is on the fence
http://134.100.15.200/flickr8k/Images/3452127051_fa54a902b3.jpg,A dog jumps to catch a red Frisbee in the yard .
http://134.100.15.200/flickr8k/Images/3452127051_fa54a902b3.jpg,A brown dog jumps over an obstacle .
http://134.100.15.200/flickr8k/Images/3452127051_fa54a902b3.jpg,A dog jumps over an obstacle .
http://134.100.15.200/flickr8k/Images/3453259666_9ecaa8bb4b.jpg,A child swinging on a playground play set .
http://134.100.15.200/flickr8k/Images/3456362961_d8f7e347a8.jpg,a white woman in a green sweater holds a smiling child whilst a smiling boy in a yellow shirt looks on .
http://134.100.15.200/flickr8k/Images/3456362961_d8f7e347a8.jpg,Little kids stand together and raise their hands in the air .
http://134.100.15.200/flickr8k/Images/3456362961_d8f7e347a8.jpg,Two dogs are playing together outside .
http://134.100.15.200/flickr8k/Images/3457045393_2bbbb4e941.jpg,Man reading a newspaper at an outdoors restaurant .
http://134.100.15.200/flickr8k/Images/3457045393_2bbbb4e941.jpg,A young girl is wearing a purple shirt and pink headband .
http://134.100.15.200/flickr8k/Images/3457045393_2bbbb4e941.jpg,A young girl dressed in pink with a hair barrette pursing her lips at a big chocolate milkshake .
http://134.100.15.200/flickr8k/Images/3458559770_12cf9f134e.jpg,A man riding a motorcycle is performing a trick at a track .
http://134.100.15.200/flickr8k/Images/3458559770_12cf9f134e.jpg,Man on a dirt bike
http://134.100.15.200/flickr8k/Images/3458559770_12cf9f134e.jpg,A man rides a bike through a course .
http://134.100.15.200/flickr8k/Images/3458559770_12cf9f134e.jpg,Two motocross riders next to each other on a dirt track .
http://134.100.15.200/flickr8k/Images/3458559770_12cf9f134e.jpg,A person wearing a red and white uniform is racing a motorcycle with the number 58 on it .
http://134.100.15.200/flickr8k/Images/3459156091_c1879ebe28.jpg,A man with a pug dog bends over to pick something off the sidewalk .
http://134.100.15.200/flickr8k/Images/3459156091_c1879ebe28.jpg,A child is preparing to slide down a piece of playground equipment .
http://134.100.15.200/flickr8k/Images/3459156091_c1879ebe28.jpg,a boy jumps into the blue pool water .
http://134.100.15.200/flickr8k/Images/3459156091_c1879ebe28.jpg,A woman is holding up a child as they coming splashing down a slide into a pool .
http://134.100.15.200/flickr8k/Images/3459156091_c1879ebe28.jpg,A woman is doing a backwards flip in front of a crowd of other people sitting on the sidewalk .
http://134.100.15.200/flickr8k/Images/3461041826_0e24cdf597.jpg,A man on a tag line going into the water .
http://134.100.15.200/flickr8k/Images/3461041826_0e24cdf597.jpg,A wrinkled dog wading in shallow water .
http://134.100.15.200/flickr8k/Images/3461041826_0e24cdf597.jpg,Man fly fishing in a small river with steam in the background .
http://134.100.15.200/flickr8k/Images/3461041826_0e24cdf597.jpg,dogs playing in a stream
http://134.100.15.200/flickr8k/Images/3461041826_0e24cdf597.jpg,A dog wading in the water with a ball in his mouth
http://134.100.15.200/flickr8k/Images/3461041826_0e24cdf597.jpg,a grey dog swimming through a river with a stick in his mouth
http://134.100.15.200/flickr8k/Images/3462454965_a481809cea.jpg,A furry dog attempts to dry itself by shaking the water off its coat .
http://134.100.15.200/flickr8k/Images/3462454965_a481809cea.jpg,Four dogs play together outside with sticks .
http://134.100.15.200/flickr8k/Images/3462454965_a481809cea.jpg,Two dogs run down a dirt path in the forest .
http://134.100.15.200/flickr8k/Images/3462454965_a481809cea.jpg,A black dog walking along a rocky terrain .
http://134.100.15.200/flickr8k/Images/3467219837_7d62213dec.jpg,A dog races along the grassy track .
http://134.100.15.200/flickr8k/Images/3467219837_7d62213dec.jpg,Two greyhounds race .
http://134.100.15.200/flickr8k/Images/3467219837_7d62213dec.jpg,Several dogs wearing muzzles are racing on a track .
http://134.100.15.200/flickr8k/Images/3468694409_a51571d621.jpg,A man in a white hat plays guitar on a stage .
http://134.100.15.200/flickr8k/Images/3468694409_a51571d621.jpg,People are gathered around watching children with a pig .
http://134.100.15.200/flickr8k/Images/3468694409_a51571d621.jpg,A young woman sitting on a ledge with a black purse looking at her finger nails .
http://134.100.15.200/flickr8k/Images/3468694409_a51571d621.jpg,A man is tying a red arm band around another mans arm in the street .
http://134.100.15.200/flickr8k/Images/3468694409_a51571d621.jpg,A man wearing a red hat looks down as another man watches .
http://134.100.15.200/flickr8k/Images/3468694409_a51571d621.jpg,The room full of youths reacts emotionally as they spectate .
http://134.100.15.200/flickr8k/Images/3468694409_a51571d621.jpg,A musician and a crowd next to stage full of musical instruments .
http://134.100.15.200/flickr8k/Images/3468694409_a51571d621.jpg,Two women are dancing while men play music behind them .
http://134.100.15.200/flickr8k/Images/3470951932_27ed74eb0b.jpg,A man in a rugby uniform hitting a ball in a grassy field .
http://134.100.15.200/flickr8k/Images/3470951932_27ed74eb0b.jpg,A boy runs to a baseball base .
http://134.100.15.200/flickr8k/Images/3471841031_a949645ba8.jpg,Two girls are sitting on a path by a river with their bicycles parked beside them .
http://134.100.15.200/flickr8k/Images/3471841031_a949645ba8.jpg,A man is riding a dirt bike over some rocks .
http://134.100.15.200/flickr8k/Images/3471841031_a949645ba8.jpg,A person in a green jacket it surfing while holding on to a line .
http://134.100.15.200/flickr8k/Images/3471841031_a949645ba8.jpg,A man wearing red shorts is holding onto the rocks beside the water .
http://134.100.15.200/flickr8k/Images/3471841031_a949645ba8.jpg,Man in brown jacket leading black horse
http://134.100.15.200/flickr8k/Images/3471841031_a949645ba8.jpg,A man at a rodeo is thrown off a horse .
http://134.100.15.200/flickr8k/Images/3472364264_dbde5a8d0a.jpg,Two dogs are running towards each other on a beach .
http://134.100.15.200/flickr8k/Images/3472364264_dbde5a8d0a.jpg,A dog is running along the beach beside the ocean .
http://134.100.15.200/flickr8k/Images/3472364264_dbde5a8d0a.jpg,a large dog runs on the beach with something hanging out of its mouth .
http://134.100.15.200/flickr8k/Images/3472364264_dbde5a8d0a.jpg,A black dog walking along a rocky terrain .
http://134.100.15.200/flickr8k/Images/3472364264_dbde5a8d0a.jpg,a dog on the beach .
http://134.100.15.200/flickr8k/Images/3473264983_67917a931f.jpg,A man with a red collar and gray beard looks at the camera .
http://134.100.15.200/flickr8k/Images/3474406285_01f3d24b71.jpg,A woman next to a dog which is running an obstacle course .
http://134.100.15.200/flickr8k/Images/3474406285_01f3d24b71.jpg,A dog jumps over an obstacle .
http://134.100.15.200/flickr8k/Images/3477715432_79d82487bb.jpg,The person in the yellow shirt is sitting with a child at a wooden picnic table .
http://134.100.15.200/flickr8k/Images/3480051754_18e5802558.jpg,A group of people walking a city street in warm weather .
http://134.100.15.200/flickr8k/Images/3480051754_18e5802558.jpg,Three people sit at an outdoor cafe .
http://134.100.15.200/flickr8k/Images/3480051754_18e5802558.jpg,A man with disheveled hair and facial hair in a crowd of people is smiling .
http://134.100.15.200/flickr8k/Images/3482062809_3b694322c4.jpg,A group of students in uniform stand in front of the gate .
http://134.100.15.200/flickr8k/Images/3482062809_3b694322c4.jpg,The person in the yellow shirt is sitting with a child at a wooden picnic table .
http://134.100.15.200/flickr8k/Images/3482974845_db4f16befa.jpg,"Two dogs , one brown and white and one black and white , run on a field ."
http://134.100.15.200/flickr8k/Images/3482974845_db4f16befa.jpg,A person walks along the beach and leaves footprints in the sand .
http://134.100.15.200/flickr8k/Images/3482974845_db4f16befa.jpg,The large brown dog is chasing after the little brown dog .
http://134.100.15.200/flickr8k/Images/3482974845_db4f16befa.jpg,A spotted dog rolling over on a pad placed on a porch .
http://134.100.15.200/flickr8k/Images/3482974845_db4f16befa.jpg,Two black dogs run through sand .
http://134.100.15.200/flickr8k/Images/3482974845_db4f16befa.jpg,a dog on the beach .
http://134.100.15.200/flickr8k/Images/348380010_33bb0599ef.jpg,A dog rolling in the grass .
http://134.100.15.200/flickr8k/Images/348380010_33bb0599ef.jpg,"Two dogs , one brown and white and one black and white , run on a field ."
http://134.100.15.200/flickr8k/Images/348380010_33bb0599ef.jpg,A spotted dog rolling over on a pad placed on a porch .
http://134.100.15.200/flickr8k/Images/348380010_33bb0599ef.jpg,The dog is on the fence
http://134.100.15.200/flickr8k/Images/3484649669_7bfe62080b.jpg,A girl goes down a blue and yellow slide at a park .
http://134.100.15.200/flickr8k/Images/3484832904_08619300d9.jpg,A boy runs to a baseball base .
http://134.100.15.200/flickr8k/Images/3484832904_08619300d9.jpg,A girl playing softball takes a strike .
http://134.100.15.200/flickr8k/Images/3484832904_08619300d9.jpg,A baseman tries to catch a ball while a runner tries to make the base in a community game .
http://134.100.15.200/flickr8k/Images/3484832904_08619300d9.jpg,The cricketer is swinging a bat in the air .
http://134.100.15.200/flickr8k/Images/3485425825_c2f3446e73.jpg,a girl peeks through the green leaves .
http://134.100.15.200/flickr8k/Images/3485425825_c2f3446e73.jpg,A woman holding a little girls hand is pointing to something trying to show her .
http://134.100.15.200/flickr8k/Images/3485425825_c2f3446e73.jpg,A little girl stands on the fence while peeking through it to look at the horse .
http://134.100.15.200/flickr8k/Images/3485425825_c2f3446e73.jpg,A woman holding a camera .
http://134.100.15.200/flickr8k/Images/3485425825_c2f3446e73.jpg,People stand outside near a concrete wall and a window .
http://134.100.15.200/flickr8k/Images/3490736665_38710f4b91.jpg,a golden retriever plays with a toy .
http://134.100.15.200/flickr8k/Images/3494394662_3edfd4a34c.jpg,A man wearing all black and a black hat is smiling .
http://134.100.15.200/flickr8k/Images/3494394662_3edfd4a34c.jpg,The football player wearing a white helmet and orange chairs swing his leg while the player next to him kneels .
http://134.100.15.200/flickr8k/Images/3494394662_3edfd4a34c.jpg,"A man in an orange jersey with the letter "" 12 "" on it plays football ."
http://134.100.15.200/flickr8k/Images/3494394662_3edfd4a34c.jpg,A man sitting on a subway .
http://134.100.15.200/flickr8k/Images/3494394662_3edfd4a34c.jpg,The man in glasses carrying an Obama poster is talking on a cellphone .
http://134.100.15.200/flickr8k/Images/3497224764_6e17544e0d.jpg,A young asian girl with a woman plays with a blue ball in a part setting .
http://134.100.15.200/flickr8k/Images/3497224764_6e17544e0d.jpg,Two girls with dark hair and white shirts .
http://134.100.15.200/flickr8k/Images/3497224764_6e17544e0d.jpg,The room full of youths reacts emotionally as they spectate .
http://134.100.15.200/flickr8k/Images/3497224764_6e17544e0d.jpg,The Asian girl wearing a pink and black striped top is walking next to the girl in the grey top .
http://134.100.15.200/flickr8k/Images/3497224764_6e17544e0d.jpg,A man wearing a green shirt looks down at a cellphone .
http://134.100.15.200/flickr8k/Images/3497224764_6e17544e0d.jpg,People stand outside near a concrete wall and a window .
http://134.100.15.200/flickr8k/Images/3498327617_d2e3db3ee3.jpg,A dog splashes through the water .
http://134.100.15.200/flickr8k/Images/3498327617_d2e3db3ee3.jpg,two conoes float down the river .
http://134.100.15.200/flickr8k/Images/3498327617_d2e3db3ee3.jpg,A girl whipping water from her hair in a lake
http://134.100.15.200/flickr8k/Images/3498327617_d2e3db3ee3.jpg,A white dog is running through the water onto the shore .
http://134.100.15.200/flickr8k/Images/3498327617_d2e3db3ee3.jpg,a brown and black dog swimming in a river
http://134.100.15.200/flickr8k/Images/3498997518_c2b16f0a0e.jpg,"The football players in red are attempting a play against those in purple , white , and gold ."
http://134.100.15.200/flickr8k/Images/3498997518_c2b16f0a0e.jpg,The young football player is trying to avoid being tackled .
http://134.100.15.200/flickr8k/Images/3498997518_c2b16f0a0e.jpg,A football player is tackling the player with the football as the crowd watches .
http://134.100.15.200/flickr8k/Images/3499720588_c32590108e.jpg,Three boys play around a fountain in an office building courtyard .
http://134.100.15.200/flickr8k/Images/3499720588_c32590108e.jpg,"A woman crosses the street near a man , who is on his cellphone ."
http://134.100.15.200/flickr8k/Images/3499720588_c32590108e.jpg,"A man and a woman walking down a street , carrying luggage ."
http://134.100.15.200/flickr8k/Images/3500136982_bf7a85531e.jpg,A skateboarder in striped shorts skating down a street .
http://134.100.15.200/flickr8k/Images/3500136982_bf7a85531e.jpg,Two boys with backpacks ride bikes through a puddle on the road .
http://134.100.15.200/flickr8k/Images/3500136982_bf7a85531e.jpg,An inline skater doing a jump on a ramp .
http://134.100.15.200/flickr8k/Images/3500136982_bf7a85531e.jpg,a girl paints the road .
http://134.100.15.200/flickr8k/Images/3502343542_f9b46688e5.jpg,A man is riding a dirt bike over some rocks .
http://134.100.15.200/flickr8k/Images/3502343542_f9b46688e5.jpg,A rock climber climbs in between two very large rocks .
http://134.100.15.200/flickr8k/Images/3502343542_f9b46688e5.jpg,A woman is holding up a child as they coming splashing down a slide into a pool .
http://134.100.15.200/flickr8k/Images/3502343542_f9b46688e5.jpg,A man scales a rock in the forest .
http://134.100.15.200/flickr8k/Images/3502343542_f9b46688e5.jpg,person rock climbing
http://134.100.15.200/flickr8k/Images/3502993968_4ee36afb0e.jpg,A woman riding a bike in a park
http://134.100.15.200/flickr8k/Images/3502993968_4ee36afb0e.jpg,Two men and a woman smile at the camera .
http://134.100.15.200/flickr8k/Images/3502993968_4ee36afb0e.jpg,A young boy is riding a bike .
