image,caption,rating
http://134.100.15.200/flickr8k/Images/2435685480_a79d42e564.jpg,The person in the yellow shirt is sitting with a child at a wooden picnic table .,1.1425568
http://134.100.15.200/flickr8k/Images/2435685480_a79d42e564.jpg,A person is hiking to the top of a hill .,3.260304
http://134.100.15.200/flickr8k/Images/2436081047_bca044c1d3.jpg,"A boy , wearing a baseball cap , jumps in the air near some steps .",2.619959
http://134.100.15.200/flickr8k/Images/2443380641_7b38d18f5b.jpg,A boy wearing a Steve Nash shirt dribbles a basketball on an indoor court .,1.8054664
http://134.100.15.200/flickr8k/Images/2443380641_7b38d18f5b.jpg,A little girl in a green outfit wringing out an orange rag .,1.2168605
http://134.100.15.200/flickr8k/Images/2443380641_7b38d18f5b.jpg,A woman holding a black leash and a man looking down .,1.5599093
http://134.100.15.200/flickr8k/Images/2443380641_7b38d18f5b.jpg,"A smiling boy in an orange shirt with a safari hat sits at the playground , while a boy in a blue shirt looks on .",3.5026886
http://134.100.15.200/flickr8k/Images/2443380641_7b38d18f5b.jpg,A person is riding in a canoe on a lake next to green trees .,1.1489552
http://134.100.15.200/flickr8k/Images/2445283938_ff477c7952.jpg,"A young boy , playing basketball , is getting ready to take a shot .",1.1421576
http://134.100.15.200/flickr8k/Images/2445283938_ff477c7952.jpg,People trackside at a subway station by a train .,1.138861
http://134.100.15.200/flickr8k/Images/2445283938_ff477c7952.jpg,Two woman and a child look at each other while a night party scene goes on behind them .,2.7817218
http://134.100.15.200/flickr8k/Images/2445283938_ff477c7952.jpg,Two little girls dance on a hardwood floor in the house .,2.8744018
http://134.100.15.200/flickr8k/Images/2445283938_ff477c7952.jpg,Two children kneeling down with pirate hats on,1.9604216
http://134.100.15.200/flickr8k/Images/244571201_0339d8e8d1.jpg,a boy jumps into the blue pool water .,2.6233087
http://134.100.15.200/flickr8k/Images/244571201_0339d8e8d1.jpg,A little boy is jumping out of the pool .,2.520307
http://134.100.15.200/flickr8k/Images/244571201_0339d8e8d1.jpg,a boy plays with a noodle by the pool .,2.5379672
http://134.100.15.200/flickr8k/Images/244571201_0339d8e8d1.jpg,A man in black shorts is diving into a rocky pool .,2.5449736
http://134.100.15.200/flickr8k/Images/244571201_0339d8e8d1.jpg,Two guys jumping into a pool .,2.4057658
http://134.100.15.200/flickr8k/Images/2447284966_d6bbdb4b6e.jpg,A young child is wearing blue goggles and sitting in a float in a pool .,1.3289437
http://134.100.15.200/flickr8k/Images/2447284966_d6bbdb4b6e.jpg,Children play in an inflatable pool .,2.2641127
http://134.100.15.200/flickr8k/Images/2447284966_d6bbdb4b6e.jpg,Child in blue trunks splashing in blue kiddie pool,3.3902693
http://134.100.15.200/flickr8k/Images/2450299735_62c095f40e.jpg,A little boy is jumping into an outdoor kiddie pool,3.520168
http://134.100.15.200/flickr8k/Images/2450299735_62c095f40e.jpg,A dog swims in a pool near a person .,2.000397
http://134.100.15.200/flickr8k/Images/2450299735_62c095f40e.jpg,A swimmer is doing the backstroke in the swimming pool .,3.7786064
http://134.100.15.200/flickr8k/Images/2450453051_f1d4a78ab4.jpg,A black and white dog prepares to catch a Frisbee .,4.262057
http://134.100.15.200/flickr8k/Images/2450453051_f1d4a78ab4.jpg,Men playing soccer in a field,2.8155375
http://134.100.15.200/flickr8k/Images/2450453051_f1d4a78ab4.jpg,A man rides a bike through a course .,1.2410877
http://134.100.15.200/flickr8k/Images/2450453051_f1d4a78ab4.jpg,A gray dog sits on a lawn wearing a bright blue long sleeved jacket .,1.1310961
http://134.100.15.200/flickr8k/Images/245252561_4f20f1c89e.jpg,A furry dog attempts to dry itself by shaking the water off its coat .,4.2278833
http://134.100.15.200/flickr8k/Images/245252561_4f20f1c89e.jpg,Black and white dog on wet sand .,3.0395396
http://134.100.15.200/flickr8k/Images/245252561_4f20f1c89e.jpg,Two brown dogs playfully fight in the snow .,2.3370328
http://134.100.15.200/flickr8k/Images/2453971388_76616b6a82.jpg,Two black dogs are dog paddling in a sparkling blue pool .,1.1371462
http://134.100.15.200/flickr8k/Images/2453971388_76616b6a82.jpg,A swimmer is doing the backstroke in the swimming pool .,1.3236586
http://134.100.15.200/flickr8k/Images/2458269558_277012780d.jpg,A toddler girl in a swing is laughing .,4.193032
http://134.100.15.200/flickr8k/Images/2458269558_277012780d.jpg,kid swinging on a swing,4.31277
http://134.100.15.200/flickr8k/Images/2458269558_277012780d.jpg,A little girl wearing a pink shirt jumps off a swing .,2.9775114
http://134.100.15.200/flickr8k/Images/2458269558_277012780d.jpg,A child is smiling while being on a swing .,4.3141885
http://134.100.15.200/flickr8k/Images/2458269558_277012780d.jpg,Little kids stand together and raise their hands in the air .,2.6799552
http://134.100.15.200/flickr8k/Images/245895500_a4eb97af02.jpg,Three dogs running through water .,1.3842275
http://134.100.15.200/flickr8k/Images/245895500_a4eb97af02.jpg,A white dog is running through the water onto the shore .,1.9786688
http://134.100.15.200/flickr8k/Images/246055693_ccb69ac5c6.jpg,A dog with a ball in his mouth running down a road covered in leaves .,2.8447785
http://134.100.15.200/flickr8k/Images/246055693_ccb69ac5c6.jpg,The three men and three dogs floated in the yellow boat .,1.1697316
http://134.100.15.200/flickr8k/Images/246055693_ccb69ac5c6.jpg,A dog jumping off a fence and another dog on the grass in the background .,3.4544559
http://134.100.15.200/flickr8k/Images/246055693_ccb69ac5c6.jpg,The dog is on the fence,3.3551922
http://134.100.15.200/flickr8k/Images/246055693_ccb69ac5c6.jpg,A brown dog hops over a fallen tree branch .,2.6114128
http://134.100.15.200/flickr8k/Images/246055693_ccb69ac5c6.jpg,A white dog and brown dog fighting .,2.406334
http://134.100.15.200/flickr8k/Images/246055693_ccb69ac5c6.jpg,Two dogs run down a dirt path in the forest .,2.2995772
http://134.100.15.200/flickr8k/Images/246055693_ccb69ac5c6.jpg,A dog is turns back toward the camera near some potted plants .,3.735111
http://134.100.15.200/flickr8k/Images/246055693_ccb69ac5c6.jpg,A small dog in front of a yellow tube on grass .,2.9565966
http://134.100.15.200/flickr8k/Images/2460797929_66446c13db.jpg,A little boy is eating his food off of a spoon while sitting on a patio .,1.1623623
http://134.100.15.200/flickr8k/Images/2460797929_66446c13db.jpg,A boy in a blue life jacket jumps into the water .,1.2199688
http://134.100.15.200/flickr8k/Images/2460797929_66446c13db.jpg,The person in the yellow shirt is sitting with a child at a wooden picnic table .,2.7490392
http://134.100.15.200/flickr8k/Images/2460797929_66446c13db.jpg,two men sit on a chairlift .,1.7284315
http://134.100.15.200/flickr8k/Images/2460797929_66446c13db.jpg,A little boy in a purple shirt and blue shorts playing with orange balls .,1.1193812
http://134.100.15.200/flickr8k/Images/2460797929_66446c13db.jpg,Child sitting at a backyard picnic table .,1.9236642
http://134.100.15.200/flickr8k/Images/2461616306_3ee7ac1b4b.jpg,a boy jumps into the blue pool water .,4.3235435
http://134.100.15.200/flickr8k/Images/2461616306_3ee7ac1b4b.jpg,A little boy is jumping out of the pool .,4.4318113
http://134.100.15.200/flickr8k/Images/2461616306_3ee7ac1b4b.jpg,Two guys jumping into a pool .,2.8344429
http://134.100.15.200/flickr8k/Images/2470486377_c3a39ccb7b.jpg,Three young adults look towards the camera in a school setting .,2.2935684
http://134.100.15.200/flickr8k/Images/2470486377_c3a39ccb7b.jpg,A little boy is holding a fishing rod .,1.647938
http://134.100.15.200/flickr8k/Images/2472980433_210ec62874.jpg,A young man attempts to ride a unicycle down an outdoor stairway stained with moss .,1.2021823
http://134.100.15.200/flickr8k/Images/2473689180_e9d8fd656a.jpg,Three dogs running through water .,1.2490984
http://134.100.15.200/flickr8k/Images/2473689180_e9d8fd656a.jpg,Two dogs moving through water close to the shore .,1.1917456
http://134.100.15.200/flickr8k/Images/2473689180_e9d8fd656a.jpg,A white dog is running through the water onto the shore .,1.3070734
http://134.100.15.200/flickr8k/Images/2473689180_e9d8fd656a.jpg,A boy is about to jump into the water .,3.4812992
http://134.100.15.200/flickr8k/Images/2473689180_e9d8fd656a.jpg,A black dog standing in shallow water with a pink ball in its mouth .,1.1626709
http://134.100.15.200/flickr8k/Images/2473689180_e9d8fd656a.jpg,A tan dog jumps into water .,1.1561635
http://134.100.15.200/flickr8k/Images/2473738924_eca928d12f.jpg,Two little girls practice martial arts .,3.9804075
http://134.100.15.200/flickr8k/Images/2473738924_eca928d12f.jpg,A young boy is practicing his karate in a gym .,2.5072532
http://134.100.15.200/flickr8k/Images/2473738924_eca928d12f.jpg,Two boxers with white gloves are fighting .,1.4815828
http://134.100.15.200/flickr8k/Images/2473791980_805c819bd4.jpg,Two dogs moving through water close to the shore .,1.251671
http://134.100.15.200/flickr8k/Images/2473791980_805c819bd4.jpg,A man is sky surfing on the water .,3.9338768
http://134.100.15.200/flickr8k/Images/2473791980_805c819bd4.jpg,A man wakeboards on choppy water .,4.166187
http://134.100.15.200/flickr8k/Images/2473791980_805c819bd4.jpg,A young girl stands under three large rings that shoot water in a water park .,1.1900264
http://134.100.15.200/flickr8k/Images/2475162978_2c51048dca.jpg,Large dog plays with two smaller dogs on grass .,1.1226203
http://134.100.15.200/flickr8k/Images/2475162978_2c51048dca.jpg,"A dog runs through a lush , green lawn .",1.469697
http://134.100.15.200/flickr8k/Images/2475162978_2c51048dca.jpg,A small child sucks his thumb while sleeping with a pink blanket on a multi-colored seat .,1.139447
http://134.100.15.200/flickr8k/Images/2475162978_2c51048dca.jpg,Two dogs wearing shirts play in the green grass .,1.1853068
http://134.100.15.200/flickr8k/Images/247637795_fdf26a03cf.jpg,A woman is taking a swing with a golf club .,3.2647624
http://134.100.15.200/flickr8k/Images/247637795_fdf26a03cf.jpg,A small black and white dog jumps at a woman in a white jeep while a golden dog follows beside them .,1.1167758
http://134.100.15.200/flickr8k/Images/247637795_fdf26a03cf.jpg,A dog is taking a dive into a body of water .,1.1891507
http://134.100.15.200/flickr8k/Images/247637795_fdf26a03cf.jpg,A black man playing basketball with orange shoes,1.1260494
http://134.100.15.200/flickr8k/Images/247637795_fdf26a03cf.jpg,Person in gray jacket and blue pants balancing board on handrail,1.9785621
http://134.100.15.200/flickr8k/Images/247637795_fdf26a03cf.jpg,a group of people sitting outside in the dirt on the ground .,1.3486807
http://134.100.15.200/flickr8k/Images/247704641_d883902277.jpg,Two dogs moving through water close to the shore .,3.9272656
http://134.100.15.200/flickr8k/Images/247704641_d883902277.jpg,The large brown dog is chasing after the little brown dog .,2.1654456
http://134.100.15.200/flickr8k/Images/247704641_d883902277.jpg,Boat number 5 has several men with life jackets paddling the water .,1.1463332
http://134.100.15.200/flickr8k/Images/247704641_d883902277.jpg,A person is riding in a canoe on a lake next to green trees .,1.2414684
http://134.100.15.200/flickr8k/Images/247704641_d883902277.jpg,A man is diving into water near a shore .,2.0073695
http://134.100.15.200/flickr8k/Images/2479162876_a5ce3306af.jpg,A brown dog shaking off water .,3.2097297
http://134.100.15.200/flickr8k/Images/2479162876_a5ce3306af.jpg,A shaggy dog runs down a dirt trail in a lush forest .,3.4594607
http://134.100.15.200/flickr8k/Images/2479162876_a5ce3306af.jpg,Two dogs run across the barren ground .,3.046488
http://134.100.15.200/flickr8k/Images/2479162876_a5ce3306af.jpg,Two dogs run down a dirt path in the forest .,2.9993882
http://134.100.15.200/flickr8k/Images/2479652566_8f9fac8af5.jpg,A small child sucks his thumb while sleeping with a pink blanket on a multi-colored seat .,1.1451738
http://134.100.15.200/flickr8k/Images/2480327661_fb69829f57.jpg,Two little girls dance on a hardwood floor in the house .,3.2725875
http://134.100.15.200/flickr8k/Images/2480850054_de3433b54a.jpg,Two dogs in motion in a grassy field with small trees .,1.3795054
http://134.100.15.200/flickr8k/Images/2480850054_de3433b54a.jpg,Brown and white dog runs through brush .,1.3714517
http://134.100.15.200/flickr8k/Images/2480850054_de3433b54a.jpg,A brown and white dogs stands in front of a wooden building while tennis balls fly through the air .,1.3166138
http://134.100.15.200/flickr8k/Images/2482629385_f370b290d1.jpg,A small dogs ears stick up as it runs in the grass .,3.116393
http://134.100.15.200/flickr8k/Images/2482629385_f370b290d1.jpg,A brown dog sitting on grass,2.7034707
http://134.100.15.200/flickr8k/Images/2482629385_f370b290d1.jpg,A small brown and white dog running through tall grass .,1.5813031
http://134.100.15.200/flickr8k/Images/2482629385_f370b290d1.jpg,A muzzled animal jumps over a metal bar and splashes through the mud .,3.4805984
http://134.100.15.200/flickr8k/Images/2482629385_f370b290d1.jpg,A small boy with braids runs through a field of tall green grass .,1.6892234
http://134.100.15.200/flickr8k/Images/2484190118_e89363c465.jpg,Two girls and a woman walking on the sidewalk,1.8927529
http://134.100.15.200/flickr8k/Images/2484190118_e89363c465.jpg,a kid standing in the middle of a dirt road,3.3000407
http://134.100.15.200/flickr8k/Images/2490768374_45d94fc658.jpg,a girl peeks through the green leaves .,3.655991
http://134.100.15.200/flickr8k/Images/2490768374_45d94fc658.jpg,People at park sitting on benches and a woman taking care of her child in the stroller .,1.1807214
http://134.100.15.200/flickr8k/Images/2490768374_45d94fc658.jpg,Children play in an inflatable pool .,3.9660184
http://134.100.15.200/flickr8k/Images/2490768374_45d94fc658.jpg,Child sitting at a backyard picnic table .,2.7285924
http://134.100.15.200/flickr8k/Images/249394748_2e4acfbbb5.jpg,Two children playing with a ball on the grass .,1.1187984
http://134.100.15.200/flickr8k/Images/249394748_2e4acfbbb5.jpg,Three dogs are running in a field .,3.996677
http://134.100.15.200/flickr8k/Images/249394748_2e4acfbbb5.jpg,A dog fetches a ball in a field .,4.0037546
http://134.100.15.200/flickr8k/Images/249394748_2e4acfbbb5.jpg,"Three black dogs , two with tan markings , are running along grass .",1.8440436
http://134.100.15.200/flickr8k/Images/249394748_2e4acfbbb5.jpg,A dog running toward the camera in a field .,3.1674247
http://134.100.15.200/flickr8k/Images/249394748_2e4acfbbb5.jpg,Two dogs are playing together outside .,4.0253983
http://134.100.15.200/flickr8k/Images/2495931537_9b8d4474b6.jpg,A white dog jumps to catch a blue ball in a living room .,1.1753638
http://134.100.15.200/flickr8k/Images/2495931537_9b8d4474b6.jpg,Close-up of dog in profile with mouth open .,2.065906
http://134.100.15.200/flickr8k/Images/2496370758_a3fbc49837.jpg,A small dogs ears stick up as it runs in the grass .,4.3729477
http://134.100.15.200/flickr8k/Images/2496370758_a3fbc49837.jpg,Small black and white dog wearing a red harness is running around with a ball in its mouth .,2.3975167
http://134.100.15.200/flickr8k/Images/2496370758_a3fbc49837.jpg,A dog chasing a deer in a field of yellow flowers .,3.1954327
http://134.100.15.200/flickr8k/Images/2496370758_a3fbc49837.jpg,Two dogs run through a field .,4.1240716
http://134.100.15.200/flickr8k/Images/2497420371_74788d7ba1.jpg,Two girls are sitting on a path by a river with their bicycles parked beside them .,1.3453307
http://134.100.15.200/flickr8k/Images/2497420371_74788d7ba1.jpg,People are gathered around watching children with a pig .,1.120474
http://134.100.15.200/flickr8k/Images/2497420371_74788d7ba1.jpg,A group of people are sitting on the porch of a brick building .,1.5574788
http://134.100.15.200/flickr8k/Images/2497420371_74788d7ba1.jpg,People are enjoying drinks at a table outside a large brick building .,2.402973
http://134.100.15.200/flickr8k/Images/2497420371_74788d7ba1.jpg,Kids are waiting at the bottom of a staircase attached to a brick building .,1.609519
http://134.100.15.200/flickr8k/Images/2498897831_0bbb5d5b51.jpg,People at park sitting on benches and a woman taking care of her child in the stroller .,2.3749156
http://134.100.15.200/flickr8k/Images/2498897831_0bbb5d5b51.jpg,A young girl is wearing a purple shirt and pink headband .,3.2897668
http://134.100.15.200/flickr8k/Images/2501595799_6316001e89.jpg,"A young , long-haired , girl on the beach , is jumping in the air .",1.3048824
http://134.100.15.200/flickr8k/Images/2501595799_6316001e89.jpg,A little boy is jumping out of the pool .,4.2280912
http://134.100.15.200/flickr8k/Images/2501595799_6316001e89.jpg,A swimmer is doing the backstroke in the swimming pool .,2.5132089
http://134.100.15.200/flickr8k/Images/2501595799_6316001e89.jpg,Three Orca whales jump in a pool at seaworld .,1.1169289
http://134.100.15.200/flickr8k/Images/2502905671_c6039804ab.jpg,Two people walking along the beach at sunset towarn a group of people .,1.2685403
http://134.100.15.200/flickr8k/Images/2502905671_c6039804ab.jpg,A person walks along the beach and leaves footprints in the sand .,3.039096
http://134.100.15.200/flickr8k/Images/2502905671_c6039804ab.jpg,A man kneels in the wet sand at a beach near a dog .,3.0781488
http://134.100.15.200/flickr8k/Images/2502905671_c6039804ab.jpg,A black dog walks on the beach near the rocks .,3.8607278
http://134.100.15.200/flickr8k/Images/2502905671_c6039804ab.jpg,a dog on the beach .,3.825094
http://134.100.15.200/flickr8k/Images/2505988632_9541f15583.jpg,"Two kids ride their bikes by the ocean , in the evening .",1.838135
http://134.100.15.200/flickr8k/Images/2505988632_9541f15583.jpg,A girl playing softball takes a strike .,2.3678434
http://134.100.15.200/flickr8k/Images/2510020918_b2ca0fb2aa.jpg,Two men and a woman smile at the camera .,1.2063327
http://134.100.15.200/flickr8k/Images/2510020918_b2ca0fb2aa.jpg,A little girl is sliding down a tunnel smiling .,2.9057221
http://134.100.15.200/flickr8k/Images/2511019188_ca71775f2d.jpg,Five black dogs running across the grass .,1.8348513
http://134.100.15.200/flickr8k/Images/2511019188_ca71775f2d.jpg,Two dogs wearing shirts play in the green grass .,2.9937239
http://134.100.15.200/flickr8k/Images/2518508760_68d8df7365.jpg,A greyhound wearing a muzzle and the number six on a yellow jacket is running on a dog track .,4.059195
http://134.100.15.200/flickr8k/Images/2518508760_68d8df7365.jpg,Three dogs running on a racing track .,2.9132955
http://134.100.15.200/flickr8k/Images/2518508760_68d8df7365.jpg,Two greyhounds race .,3.8958893
http://134.100.15.200/flickr8k/Images/2518508760_68d8df7365.jpg,"A muzzled dog in a race , with four dogs following .",2.6533017
http://134.100.15.200/flickr8k/Images/2521770311_3086ca90de.jpg,a boy plays with a noodle by the pool .,1.3603003
http://134.100.15.200/flickr8k/Images/2521770311_3086ca90de.jpg,"One child lifts another on his back , inside a room .",1.808487
http://134.100.15.200/flickr8k/Images/2521770311_3086ca90de.jpg,A woman is reading literature and sitting on the front stoop of a building .,1.611359
http://134.100.15.200/flickr8k/Images/2522297487_57edf117f7.jpg,A couple is sitting in a restaurant holding hands .,2.6068032
http://134.100.15.200/flickr8k/Images/2522297487_57edf117f7.jpg,a young boy making a big mess on the floor and table while eating cereal,1.9497812
http://134.100.15.200/flickr8k/Images/2522297487_57edf117f7.jpg,The person in the yellow shirt is sitting with a child at a wooden picnic table .,3.189261
http://134.100.15.200/flickr8k/Images/2522297487_57edf117f7.jpg,Four small children sit on tall stools at a restaurant bar .,1.4864116
http://134.100.15.200/flickr8k/Images/2522297487_57edf117f7.jpg,"The legs and feet of people sitting on a wooden table , two cameras and cigarettes on it .",1.3957602
http://134.100.15.200/flickr8k/Images/2525270674_4ab536e7ec.jpg,A white dog jumps to catch a blue ball in a living room .,2.2262907
http://134.100.15.200/flickr8k/Images/2525270674_4ab536e7ec.jpg,A brown dog sitting on grass,3.1341286
http://134.100.15.200/flickr8k/Images/2525270674_4ab536e7ec.jpg,Two long-haired puppy dogs have a romp in the snow .,1.4988711
http://134.100.15.200/flickr8k/Images/2525270674_4ab536e7ec.jpg,"Two dogs , one brown and white and one black and white , run on a field .",2.6049223
http://134.100.15.200/flickr8k/Images/2525270674_4ab536e7ec.jpg,Two dogs in motion in a grassy field with small trees .,2.9195025
http://134.100.15.200/flickr8k/Images/2525270674_4ab536e7ec.jpg,A white dog and brown dog fighting .,1.700568
http://134.100.15.200/flickr8k/Images/2525270674_4ab536e7ec.jpg,Two dogs are playing together outside .,3.0754907
http://134.100.15.200/flickr8k/Images/2525270674_4ab536e7ec.jpg,"A white dog runs in the grass ,",3.7942543
http://134.100.15.200/flickr8k/Images/2526041608_a9775ab8d7.jpg,Two girls in soccer strips are playing on a sports field .,1.7271956
http://134.100.15.200/flickr8k/Images/2526041608_a9775ab8d7.jpg,Two boys play with two dogs at the shore .,1.1508596
http://134.100.15.200/flickr8k/Images/2526041608_a9775ab8d7.jpg,Men playing soccer in a field,2.9067426
http://134.100.15.200/flickr8k/Images/2526041608_a9775ab8d7.jpg,a dog playing with a blue ball,1.1172631
http://134.100.15.200/flickr8k/Images/2526041608_a9775ab8d7.jpg,Little kids stand together and raise their hands in the air .,1.8235339
http://134.100.15.200/flickr8k/Images/2526041608_a9775ab8d7.jpg,Team members being lifted up high to catch a flying ball .,2.9499338
http://134.100.15.200/flickr8k/Images/2526585002_10987a63f3.jpg,People are in a ride that drops you from a great height .,1.8556801
http://134.100.15.200/flickr8k/Images/2526585002_10987a63f3.jpg,"A dog , lying down , tethered to the side mirror of a yellow VW bus .",2.9858518
http://134.100.15.200/flickr8k/Images/2526585002_10987a63f3.jpg,The three men and three dogs floated in the yellow boat .,4.2524414
http://134.100.15.200/flickr8k/Images/2526585002_10987a63f3.jpg,A man rides a yellow bike over a ramp while others watch .,1.6173632
http://134.100.15.200/flickr8k/Images/2529116152_4331dabf50.jpg,A man is sky surfing on the water .,1.2572045
http://134.100.15.200/flickr8k/Images/2529116152_4331dabf50.jpg,A skateboarder midair with his skateboard .,2.4678402
http://134.100.15.200/flickr8k/Images/2529116152_4331dabf50.jpg,A person is in the air while riding his bicycle on top of the train on a clear blue sky day .,2.2712154
http://134.100.15.200/flickr8k/Images/2529116152_4331dabf50.jpg,A man on a bike is jumping off a dirt ramp .,1.5746969
http://134.100.15.200/flickr8k/Images/2533424347_cf2f84872b.jpg,A race car screeches through a turn as spectators watch .,4.318715
http://134.100.15.200/flickr8k/Images/2533642917_a5eace85e6.jpg,A boy in a blue life jacket jumps into the water .,3.043034
http://134.100.15.200/flickr8k/Images/2533642917_a5eace85e6.jpg,Boys in life jackets on a watercraft .,3.3503969
http://134.100.15.200/flickr8k/Images/2533642917_a5eace85e6.jpg,A boys jumps in the water while another boy looks on .,3.1164303
http://134.100.15.200/flickr8k/Images/2533642917_a5eace85e6.jpg,A child sleds over a mound of snow as others watch him .,1.2459185
http://134.100.15.200/flickr8k/Images/2533642917_a5eace85e6.jpg,A young woman watches as a young blond boy swings in a chair swing with buildings visible in the background .,1.158374
http://134.100.15.200/flickr8k/Images/2534502836_7a75305655.jpg,A dog rolling in the grass .,3.2949548
http://134.100.15.200/flickr8k/Images/2534502836_7a75305655.jpg,Large dog plays with two smaller dogs on grass .,2.5469236
http://134.100.15.200/flickr8k/Images/2534502836_7a75305655.jpg,A tan dog runs down a wooden staircase to the green grass .,2.5841856
http://134.100.15.200/flickr8k/Images/2534502836_7a75305655.jpg,A brown and tan dog walks through the green grass .,3.953019
http://134.100.15.200/flickr8k/Images/2534502836_7a75305655.jpg,Two dogs wearing shirts play in the green grass .,2.83188
http://134.100.15.200/flickr8k/Images/2534502836_7a75305655.jpg,A small boy with braids runs through a field of tall green grass .,2.9108953
http://134.100.15.200/flickr8k/Images/2541104331_a2d65cfa54.jpg,Three dogs running through water .,2.9240193
http://134.100.15.200/flickr8k/Images/2541104331_a2d65cfa54.jpg,A dog splashes through the water .,4.133448
http://134.100.15.200/flickr8k/Images/2541104331_a2d65cfa54.jpg,A black and white dog is splashing in a stream .,3.4658937
http://134.100.15.200/flickr8k/Images/2541104331_a2d65cfa54.jpg,A young girl plays in fountain water .,2.2272708
http://134.100.15.200/flickr8k/Images/2541104331_a2d65cfa54.jpg,A person swimming in water nearby rocks and a small waterfall .,2.2631493
http://134.100.15.200/flickr8k/Images/2542662402_d781dd7f7c.jpg,A dog wading in the water with a ball in his mouth,1.3643962
http://134.100.15.200/flickr8k/Images/2542662402_d781dd7f7c.jpg,A dog jumps to catch a red Frisbee in the yard .,2.9230187
http://134.100.15.200/flickr8k/Images/254295381_d98fa049f4.jpg,A little girl in a red snowsuit sits on a snowball in a backyard .,1.7566862
http://134.100.15.200/flickr8k/Images/254295381_d98fa049f4.jpg,A little girl jumps rope through a parking lot,1.6121643
http://134.100.15.200/flickr8k/Images/2543589122_ec3e55f434.jpg,Dogs pulling a sled in a sled race .,2.2823987
http://134.100.15.200/flickr8k/Images/2543589122_ec3e55f434.jpg,A dog wearing a red harness runs across a field,1.1830567
http://134.100.15.200/flickr8k/Images/2543589122_ec3e55f434.jpg,a dog is making a splash in a blue paddling pool .,4.436591
http://134.100.15.200/flickr8k/Images/2543589122_ec3e55f434.jpg,dogs playing in a stream,3.2877545
http://134.100.15.200/flickr8k/Images/2543589122_ec3e55f434.jpg,Three Orca whales jump in a pool at seaworld .,1.2195425
